[{"details":"1) Shri S.G.Kinkar (91), Director, Textile, Nagpur has been Posted as Commissioner, TERI, Pune -- Vacant Post.\r\n\r\n2) Shri D.S.Patil (98) the then Commissioner Ulhasnagar Muncp.Corpn, Ulhasnagar has been Posted as Additional Commissioner, Tribal Development, Thane -- Vacant Post.","title":"Transferred on 17.10.2006","publishdatetime":"2019-03-02 14:03:20.0"},{"details":"1) After completion of Central Deputation Shri Amitabh Rajan (79), has been Posted as Investment and Protocol Commissioner, Maharashtra Sadan, New Delhi in place of Shri B.S.Meena.\r\n\r\n2) Shri Jayant Kawale (81) has been Posted as Secretary (Energy), Industries, Energy & Labour Department, Mantralaya, Mumbai in place of Shri Bhagwan Sahai.\r\n\r\n3) Shri Ramesh (81) MD, Mahatma Phule BC Devp.Corpn, Mumbai has been posted as Secretary (Social Justice), Social Justice, Cultural Affairs and Special Assistance Department, Mantralaya, Mumbai in place of Shri Sumit Mallick.\r\n\r\n4) Shri Sumit Mallick (82) Secretary (Social Justice), Social Justice, Cultural Affairs and Special Assistance Department, Mantralaya, Mumbai has been Posted as Secretary (Social Development Cell), General Administration Department, Mantralaya, Mumbai-- Vacant Post.\r\n\r\n5) Shri A.B.P.Pandey (84) has been Posted as MD, MSEDCL, Mumbai in place of Shri Sanjay Bhatia.\r\n\r\n6) Shri Bhagwan Sahai(84) Secretary (Energy), Industries, Energy & Labour Department, Mantralaya, Mumbai has been posted as Chairman, Nagpur Improvement Trust, Nagpur-- Vacant Post.\r\n\r\n7) Shri Sanjay Bhatia (85) MD, MSEDCL, Mumbai has been posted as Professor, YASHADA, Pune -- Vacant Post.\r\n\r\n","title":"Transferred on 27.10.2006","publishdatetime":"2006-10-30 10:41:16.0"},{"details":"1) Shri M.S.Chowdhari (95), DS, Public Health Department, Mantralaya, Mumbai has been Posted as Director, State Health Mission, Mumbai -- New Post.\r\n\r\n2) Shri P.D.Gabrial (98), Additional Commissioner, Nagpur Municipal Corporation, Nagpur has been Posted as Director, Textile, Nagpur in place of Shri S.G.Kinkar.","title":"Transferred on 18.10.2006","publishdatetime":"2006-10-19 10:26:45.0"},{"details":"Shri V.R.Bangirwar, Additional Commissioner, Tribal Development, Amaravati has been transfered as Member Secretary, Vidharbha Statutary Development Board, Nagpur -- Vacant Post.","title":"Transferred on 30.8.2005","publishdatetime":"2005-08-31 16:28:48.0"},{"details":"The State Government has given extension in service to Shri R.M.Premkumar, for a period of three months with effect from the 1st September, 2005 to 30th November 2005.","title":"The extension in service to CS","publishdatetime":"2005-09-01 10:32:49.0"},{"details":"Subject :-\tDeputation of Officers for the posts of Director (Rs.14300-400-18300/-) at NIFT Centres, Kannur, Shillong, Bhopal and Patna.\r\n\r\n\tNational Institute of Fashion Technology [NIFT], a premier Institute for imparting Fashion Business Education was set up by Ministry of Textiles with its eight Centres located at New Delhi, Mumbai, Kolkata, Chennai, Huderabad, Gandhinagar, Bangalore & Rae Bareli.  The Institute has been conferred statutory status by NFFT Act, 2006, for promotion and development of education and research in Fashion Technology leading to Graduate and Post Graduate degrees, Doctoral and Post Doctoral Courses.\r\n2.\tFour new NIFT Centres at Kannur, Shillong, Bhopal and Patna are proposed to be opened shortly and NIFT is in the process of recruitment of Directors for these new Centres.  The posts are required to be filled on deputation from Officers of All India Services, Other Central Services and State Civil Services, in the grade of Deputation Secretary/Director.\r\n\tEligible and interested officers [1993-1995 Batch] are requested to apply urgently and to contact Under Secretary, General Administration Department, Mantralaya, Mumbai immediately. (Tel.No.022-22874955 or 22793205) for further details.\r\n\r\n   Sd/-\r\n Under Secretary to the\r\nGovernment of Maharashtra\r\n","title":"Deputation of Officers for the posts of Director (Rs.14300-400-18300/-) at NIFT Centres, Kannur, Shillong, Bhopal and Patna","publishdatetime":"2008-05-21 16:33:09.0"},{"details":"After completion of Central Deputation Shri A.B.Kulkarni has been Posted as Managing Director, MSSIDC, Mumbai -- Vacant post.\r\n","title":"Transfer dated 15.09.2005","publishdatetime":"2005-09-20 16:21:34.0"},{"details":"After completion of Central Deputation Shri A.B.Kulkarni has been Posted as Managing Director, MSSIDC, Mumbai -- Vacant post.\r\n","title":"Transferred on 08.09.2005","publishdatetime":"2005-09-20 16:22:59.0"},{"details":"1) Shri R.C.Sagar (86) has been Posted as Managing Director, MELTRON, Mumbai -- Vacant post.\r\n2) Shri P.D.Karwande (96) has been Posted as Additional Collector, Nagpur -- Vacant post.","title":"","publishdatetime":"2005-10-03 10:18:32.0"},{"details":"1) Shri R.C.Sagar (86) has been Posted as Managing Director, MELTRON, Mumbai -- Vacant post.\r\n2) Shri P.D.Karwande (96) has been Posted as Additional Collector, Nagpur -- Vacant post.","title":"Transfer on 28.9.2005","publishdatetime":"2005-10-03 10:19:50.0"},{"details":") Shri B.V.Gopalla Reddy (94) has been Posted as Director, M.S.Horticulture & Medical Plant Corporation, Pune  -- New State Deputation post.\r\n2) Smt.Charusheela Sohoni  (71) has been relived Central Deputation, Chairman, TARIFF Commission. ","title":"Transfered 19 & 20.10.2005","publishdatetime":"2005-10-20 17:11:45.0"},{"details":"1)Smt.Valsa Nair-Singh(91), Jt. M.D., M.S.Cotton Growers Mktg Fed.has been Posted as Additional Commissioner, Konkan Division, Mumbai in place of Shri V.S.Nahata.\r\n\r\n2)Shri Praveen Darade (98), Project Manager, Jalswaraj Project, Mumbai has been Posted as Collector, Kolhapur in place of Shri H.R.Pawar.\r\n\r\n3)Shri H.R.Pawar(91), Collector, Kolhapur has been Posted as Member Secretary, M.S.Agriculture Education & Research Institute, Pune --vacant Post.\r\n\r\n4)Shri B.K.Naik (91), Dy.Secretary, RDD has been Posted as Collector, Gondia in place of Shri Rupinder Singh.\r\n\r\n5)Shri S.S.Yeole, (98), CEO, ZP, Nanded has been Posted as Deputy Secretary, RDD  in place of Shri B.K.Naik.\r\n\r\n6)Shri M.H.Sawant(98), Additional Collector, MSD, Mumbai has been Posted as Deputy Secretary, School Education & Sports Department -- Vacant post.\r\n\r\n7)Shri P.E.Gaikwad(98), CEO, ZP, Parbhani has been Posted as Additional Collector, MSD, Mumbai in place of Shri M.H.Sawant.\r\n\r\n8)Shri V.S.Nahata (95), Additional Commissioner, Konkan Division has been posted as Jt. M.D., M.S.Cotton Growers Mktg Fed.in place of Smt. Valsa Nair-Singh.\r\n\r\n9)Shri P.T.Nalawade (96), Collector, Sindhudurg has been Posted as Deputy Commissioner, Sales Tax, Mumbai -- Vacant Post.\r\n\r\n10)Smt.Vijayalakshmi Bidari (2001), CEO, ZP, Sindhudurg has been Posted as Collector, Sindhudurg in place of Shri P.T.Nalawade.\r\n\r\n11)Shri Praveen Gedam(2002), Assistant Collector, Wardha has been Posted as Municipal Corporation, Jalgaon  --Vacant Post.\r\n\r\n12)Shri G.B.Maware(98), Project Officer, Intregared Tribal Devp.Scheme, Kalwan, Nashik has been Posted as CEO, ZP, Nanded in place of Shri S.S.Yeole.\r\n\r\n","title":"Transferred on 04.10.2005","publishdatetime":"2005-10-21 16:47:48.0"},{"details":"1)Shri Rupinder Singh (96), Collecor, Gondia  has been Posted as Deputy Secretary, Planning Commission, New Delhi for Central Deputation.\r\n\r\n2)Shri Sanjay Deshmukh (98), Project Officer, Integrated Tribal Development Project, Taloda, Dist.Nandurbar has been Posted as Project Manager, Jalswaraj Project, Mumbai in place of Shri Praveen Darade\r\n\r\n\r\n\r\n","title":"Transferred on 05.10.2005","publishdatetime":"2005-10-24 10:28:11.0"},{"details":"1) After completion of Foreign Assignment Shri Manoj Saunik has been Posted as Managing Director, Maharashtra State Finance Commission, Pune in place of Shri G.T.Bandri.\r\n\r\n2) After completion of Foreign Assignment Smt. Sujata Saunik has been Posted as Prefessor, YASHADA, Pune-- Vacant Post.\r\n\r\n3) Shri G.T.Bandri, M.D., M.S.Farming Corpn., Pune has been Posted as Divisional Commissioner, Konkan Division, Mumbai in place of Shri Ramesh Ubale.\r\n\r\n4) Shri Ramesh Ubale, Divisional Commissioner, Konkan Division, Mumbai has been Posted as M.D., M.S.Mahtma Phule Backward Class Development Corporation, Mumbai in place of Shri R.G.Bansod.\r\n\r\n5) Shri R.G.Bansod, M.D., M.S.Mahtma Phule Backward Class Development Corporation, Mumbai has been Posted as Dairy Development Commissioner, Mumbai in place of Shri Baldev Chand.\r\n\r\n6) Shri Baldev Chand, Dairy Development Commissioner, Mumbai has been Posted as Principal Secretary (Social Justice), Mumbai -- Vacant Post.\r\n\r\n7) Shri U.P.Khobragade, VC&MD, MSRTC, Mumbai has been Posted as Secretary (Textile), Mumbai in place of Shri Charusheela Sohoni \r\n\r\n8) Shri K.U.Gajbhiye, Divisional Commissioner, Nashik Division, Nashik has been Posted as VC&MD, MSRTC in place of Shri Khobragade.\r\n\r\n9) Dr.P.S.Meena, MD, M.S.Cotton Growers Marketing Federation, Mumbai has been Posted as MD, M.S.Co-Operative Marketing Federation, Mumbai in place of Shri D.N.Khamatkar.\r\n\r\n10) Shri D.N.Khamatkar, MD, M.S.Co-Operative Marketing Federation, Mumbai has been Posted as MD, MAHANANDA, Mumbai in place of Shri R.A.Rajeev.\r\n\r\n11) Shri R.A.Rajeev, MD, MAHANANDA, Mumbai has been Posted as MD, M.S.Cotton Growers Marketing Federation, Mumbai in place of Dr.P.S.Meena\r\n","title":"Transferred on 07.11.2005","publishdatetime":"2005-11-09 12:44:51.0"},{"details":"1.Shri G.S.Gill (76), PS, Medical Education & Drugs, Department, Mantralaya, Mumbai has been posted as PS (Transport & State Excise), Home Department, Mantralaya, Mumbai\tIn place of Shri R.R.Sinha.\r\n\r\n2.After completation of Central Deputation Smt.Leena Mehandale(74)has been posted as PS & Special Enquiry Officer (1), General Administration Department, Mantralaya, Mumbai in place of Shri Ranjana Sinha. \r\n\r\n3.Shri A.M.Khan (79)Secretary, MERC, Mumbai has been posted as Secretary, Medical Education & Drugs, Department, Mantralaya, Mumbai in place of Shri G.S.Gill.\r\n","title":"Transferred on 09.11.2005","publishdatetime":"2005-11-10 10:23:25.0"},{"details":"1.      Shri Sanjay Chahande (88), Project Commissioner, Maharashtra Health Development Scheme, Mumbai has been posted as Divisional Commissioner, Nashik Division, Nashik in place of Shri K.U.Gajbhiye.\r\n\r\n2.      Smt. Radhika Rastogi (95), Deputy Secretary, Planning Department, Mantralaya, Mumbai has been posted as Deputy Secretary (Tourism), Home Department, Mantralaya, Mumbai -- Vacant Post.\r\n\r\n3.    Shri S.S.Yeole (98), has been posted as Project Officer, Integrated Tribal Development Scheme, Kalwan, Nashik -- Vacant Post.\r\n\r\n\r\n\r\n","title":"Transferred on 11.11.2005","publishdatetime":"2005-11-14 10:40:21.0"},{"details":"Shri V.S.Bute (96), Additional Commissioner, Nagpur Division, Nagpur has been posted as Collector, Gondia -- Vacant post (Shri B.K.Naik has been not join in this post)\r\n\r\n\r\n","title":"Transferred on 16.11.2005","publishdatetime":"2005-11-17 10:06:42.0"},{"details":"1) After completation of Central Deputation Shri Deepak Kapoor (91)has been posted as Collector, Satara in place of Shri S.B.Patil.\r\n\r\n2) Shri S.B.Patil (95), Collector, Satara has been posted as Municipal Commissioner, Kolhapur Municipal Corporation, Kolhapur in place of Shri K.G.Govindaraj.\r\n\r\n3) Smt.Manisha Verma (93), Collector, Solapur has been posted as Additional Commissioner, Nagpur Division, Nagpur-- Vacant Post.\r\n\r\n4) Shri K.H.Govindaraj (95), Municipal Commissioner, Kolhapur Municipal Corporation has been posted as Collector, Solapur in place of Smt.Manisha Verma.\r\n\r\n","title":"Transferred on 19.11.2005","publishdatetime":"2005-11-21 10:17:43.0"},{"details":"Shri D.S.Patil (98), Project Officer, Integreated Tribal Development Project, Dahanu, Thane has been posted as Municipal Commissioner, Ulhasnagar Municipal Corporation, Ulhasnagar in place of Shri R.K.Sonavane-Chief Officer cadre officer.\r\n\r\n","title":"Transferred on 02.12.2005","publishdatetime":"2005-12-03 11:44:20.0"},{"details":"The State Government has given extension in service to Shri R.M.Premkumar, for a period of another three months with effect from the 1st December, 2005 to 28th February, 2006.","title":"The Extension in service to CS","publishdatetime":"2005-12-03 11:45:55.0"},{"details":"1) Shri A.D.Kale (93), Joint Managing Director, M.S.Road Transport Corporation, Mumbai has been posted as Controller of Rationing & Director (S/M), Civil Supplies, Mumbai  -- Vacant Post.\r\n\r\n2) Shri R.N.Shingare (), has been posted as Deputy Secretary (Labour), Industries, Energy & Labour Department, Mantralaya, Mumbai.-- Vacant Post. \r\n\r\n","title":"Transferred on 07.12.2005","publishdatetime":"2005-12-08 10:48:53.0"},{"details":"1) Shri Deepak Kapoor(91), Joint Chief Executive Officer, MIDC, Mumbai has been posted as Joint Managing Director, CIDCO, Mumbai in place of Smt.Sonia Sethi.\r\n\r\n2) Smt.Sonia Sethi (94), Joint Managing Director, CIDCO, Mumbai has been posted as Joint Managing Director, M.S.Road Development Corporation, Mumbai--- Vacant Post.\r\n\r\n\r\n\r\n\r\nShri R.R.Sinha (76)has been retired voluntary as on 09.12.2005\r\n\r\n","title":"Transferred on 12.12.2005","publishdatetime":"2005-12-15 10:48:05.0"},{"details":"1) Shri N.Arumugam(83), Divisional Commissioner, Amaravati Division, Amaravati has been posted as Managing Director, M.S.Farming Corporation, Pune in place of Shri Manoj Saunik.\r\n\r\n2) Shri Manoj Saunik(87), Managing Director, M.S.Farming Corporation, Pune has been posted as Director General, Kailash Vasantrao Naik Farming Sawavlamban Mishan, Amaravati-- Vacant Post\r\n\r\n3) Smt.Sujata Saunik (87), Professor, YASHADA, Pune has been posted as Divisional Commissioner, Amaravati Division, Amaravati in place of Shri N.Arumugam.\r\n\r\n4) Shri R.R.Jadhav (98), Additional Collector, Pune has been posted as Controller of Raitioning and Director (S/M), Civil Supplies, Mumbai -- Vacant Post.\r\n\r\n\r\n","title":"Transferred on 17.12.2005","publishdatetime":"2005-12-20 12:25:12.0"},{"details":"1) Shri Kunal Kumar(99), Additional Commissioner, Nagpur Municipal Corporation, Nagpur has been posted as Municipal Commissioner, Kolhapur Municipal Corporation, Kolhapur -- Vacant Post.\r\n\r\n2) Shri Philip D.Gabrial(98), Chief Executive Officer, Z.P., Chandrapur has been posted as Additional Commissioner, Nagpur Municipal Corporation, Nagpur in place of Shri Kunal Kumar.\r\n\r\n3) Shri Pankaj Kumar (2002), Assistant Collector, Devri, Dist. Gondia, has been posted as Chief Executive Officer, Z.P., Chandrapur in place of Shri Gabrial.\r\n\r\n","title":"Transferred on 19.12.2005","publishdatetime":"2005-12-20 12:18:51.0"},{"details":"After returning from Study Leave Smt.Malini Shankar (84) has been posted as Secretary, Maharashtra Electrity Regularoty Commission, Mumbai--Vacant Post","title":"Transferred on 17.12.2005","publishdatetime":"2005-12-20 12:26:01.0"},{"details":"1.\tShri U.P.Khobragade,  (84), VC&MD, MSRTC has been posted as Secretary (ADF), Agri, ADF Department, Mantralaya, Mumbai in place of Shri J.P.Dange.\r\n2.\tShri J.P.Dange, (74), Principal Secretary (ADF), Agri, ADF Department, Mantralaya, Mumbai has been posted as Principal Secretary (Labour), Industries, Energy & Labour Department, Mantralaya, Mumbai in place of Dr.Bhagwan Sahai.\r\n3.\tDr.Bhagwan Sahai, (84), Secretary (Labour), Industries, Energy & Labour Department, Mantralaya, Mumbai has been posted as Managing Director, Maharashtra State Electricity Board Holding Co., Mumbai in place of Shri Jayant Kawale\r\n4.\tShri V.K.Aggarwal, (73), Principal Secretary (Revenue), Revenue & Forests Department has been posted as Principal Secretary and Development Commissioner, Planning Department, Mantralaya, Mumbai in place of Shri J.S.Sahani\r\n5.\tShri J.S.Sahani, (76), Principal Secretary and Development Commissioner, Planning Department, Mantralaya, Mumbai has been posted as Managing Director, SICOM, Mumbai in place of Shri Rajiv Jalota.\r\n6.\tShri Rajiv Jalota, (88), Managing Director, SICOM, Mumbai has been posted as Chief Executive Officer, MIDC, Mumbai in place of Shri Satish Gavai.\r\n7.\tShri Satish Gavai, (84), Chief Executive Officer, MIDC, Mumbai has been posted as Commissioner, Small Savings & State Lotteries, Mumbai in place of Shri Mukesh Khullar.\r\n8.\tShri Mukesh Khullar, (85), Commissioner, Small Savings & State Lotteries, Mumbai has been posted as Secretary & Chief Protocol Officer, General Administration Department, Mantralaya, Mumbai \u2013 Vacant Post.\r\n9.\tSmt.Sharwaree Gokhale, (74), Development Commissioner, Industries, Mumbai has been posted as Principal Secretary, Environment Department, Mantralaya, Mumbai \u2013 New Post.\r\n10.\tDr.K.Shivaji, (74), Managing Director, M.S.Financial Corporation, Mumbai has been posted as Development Commissioner, Industries, Mumbai in place of Smt.Sharwaree Gokhale.\r\n11.\tShri S.S.Hussain, (76), Principal Secretary (Forests), Revenue & Forests Department, Mantralaya, Mumbai has been posted as Principal Secretary (Revenue), Revenue & Forests Department, Mantralaya, Mumbai in place of Shri V.K.Aggarwal.\r\n12.\tShri B.P.Pandey, (76), Principal Secretary (Energy), Industries, Energy an Labour Department, Mantralaya, Mumbai has been posted as Managing Director, Mah.Petrochemicals Corporation Ltd., Mumbai in place of Smt.Chandra Iyengar.\r\n13.\tShri Jayant Kawale, (81), Managing Director, Maharashtra State Electricity Board Holding Co., Mumbai has been posted as Secretary (Energy), Industries, Energy an Labour Department, Mantralaya, Mumbai in place of Shri B.P.Pandey.\r\n14.\tSmt.Ranjana Sinha, (75), has been posted as Principal Secretary (Textile), Co-operation, Marketing & Textiles Department, Mantralaya, Mumbai \u2013 Vavant Post.\r\n15.\tShri S.V.R.Sriniwas, (91), Commissioner, Solapur Municipal Corporation, Solapur has been posted as Managing Director, M.S.Seeds Corporation, Akola in place of Shri Anoop Kumar.\r\n16.\tShri Anoop Kumar, (90), Managing Director, M.S.Seeds Corporation, Akola has been posted as Commissioner, Solapur Municipal Corporation, Solapur in place of  Shri S.V.R.Sriniwas\r\n","title":"Transferred on 04.01.2006","publishdatetime":"2006-01-05 12:09:34.0"},{"details":"1.\tSmt.Neela Satnarayan, (72), Principal Secretary (A&S), Home Department, Mantralaya, Mumbai has been posted as Principal Secretary (Forests), Revenue & Forests Department, Mantralaya, Mumbai in place of Shri S.S.Hussain.\r\n2.\tSmt.Chandra Iyengar, (73), Managing Director, Mah.Petrochemicals Corporation Ltd., has been posted as Principal Secretary (A&S), Home Department, Mantralaya, Mumbai in place of Smt.Neela Satnarayan\r\n","title":"Transferred on 05.01.2006","publishdatetime":"2006-01-05 12:12:27.0"},{"details":"1) Shri C.K.Anil, (Bihar-91), Jt.Managing Director, M.S.Textile Corporation, Mumbai has been posted as Director, Sports & Youth Welfare, Pune -- vacant post.\r\n\r\n2) After completation of Central Deputation Shri S.N.Karle, (91), has been posted as Dy.Director, Land Records, Pune -- vacant post.\r\n\r\n3) Shri Anoop Kumar & Shri S.V.R.Sriniwas's transferred order's cancled.","title":"Transferred dated 6.1.2006 & 18.1.2006","publishdatetime":"2006-01-21 15:16:25.0"},{"details":"Shri Y.E.Kerure (97), CEO, ZP, Osmanabad has been posted as Additional Controller of Stamp, Principal Stamp Office, Mumbai -- Vacant Post.","title":"transferred on 4.2.2006","publishdatetime":"2006-02-07 16:07:25.0"},{"details":"1) Shri S.K.Goel (82), Commissioner,Agriculture, Pune has been posted as Divisional Commissioner, Amaravati Division -- Vacant post.\r\n\r\n2) Shri Manoj Saunik (87) Director Genral, Kai Vasantrao Naik Agriculture Self Reliance Mission, Amaravati has been posted as Private Secretary to Union Minister of Energy (Shri Sushilkumar Shinde)\r\n\r\n3) Shri Anoop Kumar (90), M.D., Maharashtra State Seeds Corporation, Akola has been posted as Director Genral, Kai Vasantrao Naik Agriculture Self Reliance Mission, Amaravati in place of Shri Saunik.\r\n\r\n4) Shri N.M.Kawade (95), Collector Beed has been posted as Project Commissioner, Maharashtra State Health Development Project, Mumbai  -- Vacant Post.\r\n\r\n5) Shri Piyush Singh (2000), C.E.O., Z.P., Beed has been posted as Collector, Beed in place of Shri Kawade.","title":"transferred on 7.2.2006","publishdatetime":"2006-02-08 11:26:25.0"},{"details":"Dr.D.K.Sankaran, (70) has been appointed as Chief Secretary, Government of Maharashtra in place of Shri R.M.Premkumar.","title":"Appointment New CS 1.3.2006","publishdatetime":"2006-03-02 10:25:56.0"},{"details":"1) Shri V.J.Bhosale (98), CEO, Pimpri-Chinchwad New Township Devp,Pimpri has been posted as MD, M.S.Fishries Devp.Corpn, Mumbai in place of Shri Madhav Sangle.\r\n2) Shri Madhav Sangle (91), MD, M.S.Fishries Devp.Corpn, Mumbai has been posted as Additional Divisional Commissioner, Aurangabad in place of Shri M.N.Bhagat.\r\n3) Shri M.N.Bhagat(96), Additional Commissioner, Aurangabad has been posted as Collector, Parbhani in place of Shri M.S.Choudhari.\r\n4) Shri M.S.Choudhari(95), Collector, Parbhani has been posted as Dy.Secretary, Public Health Department, Mantralaya, Mumbai in place of Shri S.R.Daund.\r\n5) Shri S.R.Daund(97), Dy.Secretary, Public Health Department, Mantralaya, Mumbai has been posted as Secretary, State Information Commission new post.\r\n6) Shri S.V.R.Srinivasan(91), Commissioner, Solapur Municipal Corporation, Solapur has been posted as Commissioner, Animal Husbandary, Pune in place of Shri Bijay Kumar.\r\n7) Shri M.H.Sawant(91), has been posted as Dy.Secretary, Finance Department, Mantralaya, Mumbai, vacant post.\r\n8) Shri K.S.Shingare (SCS-Select List Officer), Additional Collector, Dhule has been posted as Additional Collector & Competent Authority (ULC), Pune in place of Shri Satav (Non-cadre officer).\r\n9) Shri V.V.Vaidya(SCS-Select List Officer), Additional Collector, Satara has been posted as Additional Collector, Pune - Vacant Post.\r\n10) Shri B.G.Wagh (SCS-Select List Officer), Dy.Commissioner(Rehabilition), Nashik Division has been posted as C.E.O., Z.P., Beed - Vacant Post.\r\n11) Shri B.J.Sasane (SCS-Select List Officer), Dy.Director, Social Welfare, Pune has been posted as C.E.O., Z.P., Osmanabad - Vacant Post.\r\n12) Shri S.G.Malkolikar(SCS-Select List Officer), Regional Enquiry Officer, Aurangabad Division has been posted as C.E.O., Z.P., Akola in place of Shri B.R.Pokharkar\r\n13) Shri D.G.(Non-SCS-Select List Officer), Dy.Transport Commissioner, Mumbai has been posted as Additional Commissioner, Tribal Development, Thane - Vacant Post.\r\n","title":"Transferred on 1.3.2006","publishdatetime":"2006-03-02 10:41:10.0"},{"details":"1) Shri M.N.Bhagat(96), Additional Commissioner, Aurangabad has been posted as Collector, Parbhani in place of Shri M.S.Choudhari----- Revoking stayed.\r\n2) Shri M.S.Choudhari(95), Collector, Parbhani has been posted as Dy.Secretary, Public Health Department, Mantralaya, Mumbai in place of Shri S.R.Daund----------Revoking stayed.\r\n3) After completion of Central Deputation Shri S.K.Biswas(91),has been posted as M.D., M.S.Financial Corpn., Mumbai------- Vacant Post","title":"Transferred on 31.03.2006","publishdatetime":"2006-04-01 10:46:38.0"},{"details":"1) Shri Rajeev Kumar Mital(98), Collector, Bhandra has been posted as Collector, Latur-- Vacant Post.\r\n\r\n2) Smt.Indra Mallo Jain (99), CEO, ZP, Gadchiroli has been posted as Collector, Bhandara in place of Shri Rajeev Kumar Mital \r\n\r\n3) Shri Pravin Gedam(2002), Municipal Commissioner, Jalgaon Municipal Corporation has been posted as CEO, ZP, Latur in place of Shri S.P.Kadu Patil.\r\n\r\n4) Shri Mahesh Zagade(93), Collector, Nashik  has been posted as Additional Municipal Commissioner, Pune Municipal Corpn., Pune in place of Shri D.S.Zagade.\r\n\r\n5) Shri D.S.Zagade(91), Additional Municipal Commissioner, Pune Municipal Corporation, Pune  has been posted as Collector, Raigad in place of Shri B.Y.Wankhede.\r\n\r\n6) Shri B.Y.Wankhede(95), Collector, Raigad has been posted as Deputy Secretary (WC), Rural Development & Water Conservation Department, Mantralaya, Mumbai-- Vacant Post.\r\n\r\n7) Shri S.Chokalingam(96), Collector, Wardha  has been posted as Collector, Nashik in place of Shri Mahesh Zagade.\r\n\r\n8) Shri E.Z.Khobragade(96), CEO, ZP, Nagpur has been posted as Collector, Wardha  in place of Shri S.Chokalingam.\r\n\r\n9) Smt.Anshu Sinha(99), CEO, ZP, Wardha has been posted as CEO, ZP, Nagpur in place of Shri E.Z.Khobragade.\r\n\r\n10) Shri S.K.Kamble(98), CEO, ZP, Hingoli has been posted as CEO. ZP, Wardha in place of Smt.Anshu Sinha.\r\n\r\n11) Shri I.S.Chahal(89), O.S.D., Dharavi Project, MHADA, Mumbai has been posted as Vice President and CEO, MHADA, Mumbai in place of Shri S.J.Kunte.\r\n\r\n12) Shri S.J.Kunte(85), Vice President and CEO, MHADA, Mumbai has been posted as Secretary to Governor, Malabar Hill, Mumbai -- Vacant Post.\r\n\r\n\r\n\r\n\r\n\r\n\r\n\r\n\r\n","title":"Transferred on 10.05.2006","publishdatetime":"2006-05-31 10:31:50.0"},{"details":"1) Shri B.R.Pokharkar(96), CEO, ZP, Akola has been posted as Member Secretary, Rest of Maharashtra Statutory Devp.Board, Mumbai -- Vacant Post.\r\n\r\n2) Shri S.K.Kamble(98), CEO, ZP, Hingoli has been posted as Municipal Commissioner, Ulhasnagar Municipal Corporation, Ulhasnagar in place of Shri D.S.Patil. His CEO, ZP, Wardha Order is cancled.\r\n\r\n3) Shri D.S.Patil(98), Municipal Commissioner, Ulhasnagar Municipal Corporation, Ulhasnagar  has been posted as CEO. ZP, Wardha in place of Shri S.K.Kamble.","title":"Transferred on 29.05.2006","publishdatetime":"2006-05-31 10:39:26.0"},{"details":"1) Shri Sanjay Kumar (84), Chairman & MD, M.S.Warehousing Corpn., Pune has been posted as Divisional Commissioner, Aurangabad Division, Aurangabad-- Vacant Post.\r\n\r\n2) Shri N.Arumugam(83), MD, M.S.Farming Corpn., Pune has been posted as MD, M.S.Cotton Growers Mrktg. Federation, Mumbai in place of Shri R.A.Rajeev.\r\n\r\n3) Shri R.A.Rajeev(87), MD, M.S.Cotton Growers Mrktg. Federation, Mumbai has been posted as Addl.Commissioner, Greater Mumbai Municipal Corporation in place of Shri Surath Ratho.\r\n\r\n4) After completion Central Deputation tenure Shri Shyamlal Goyal(85)has been posted as MD, M.S.Farming Corporation, Pune inm place of Shri N.Arumugam.\r\n\r\n5) Shri S.G.Kinkar(91), Addl.Commr, Tribal Devp. Nagpur has been posted as Director, Textile, Nagpur in place of Smt.Abha Shukla.\r\n\r\n6) Smt.Abha Shukla (93), Director, Textile, Nagpur has been posted as Addl.Commissioner, Nagpur Division, Nagpur in place of Smt.Manisha Verma.\r\n\r\n7) Shri M.S.Deonikar(95), Collector, Osmanabad has been posted as Commissioner, Solapur Municipal Corporation, Solapur in place of Shri S.V.R.Sriniwas.\r\n\r\n8) Shri D.R.Bansod(96), CEO, ZP, Buldana has been posted as Collector, Osmanabad in place of Shri M.S.Deonikar.\r\n\r\n9) Shri S.V.R.Sriniwas(93), Commissioner, Solapur Municipal Corpn., Solapur has been posted as Joint MD, MSRDC, Mumbai in place of Shri V.Giriraj.\r\n\r\n10) Shri V.Giriraj(85), Jt.MD, MSRDC, Mumbai  has been posted as Secretary (Agriculture), Agri & ADF Department, Mantralaya, Mumbai in place of Shri Mukesh Khullar.\r\n\r\n11) Smt.Manisha Patankar-Mhaiskar (92), Collector, Sangli has been posted as Director General, I&PR, Mumbai, -- Vacant Post.\r\n\r\n12) Shri R.R.Chavan (96), CEO, ZP, Pune has been posted as Collector, Sangli in place of Smt.Manisha Patankar - Mhaiskar. \r\n\r\n13) Shri Milind Mhaiskar(92), Commissioner, Sangli-Miraj-Kupwad Municipal Corpn., Sangli  has been posted as Joint Commissioner, MMRDA, Mumbai -- Vacant Post.\r\n\r\n14) Shri S.P.Kadu-Patil(98), has been posted as CEO, ZP, Satara in place of Shri J.D.Patil.\r\n\r\n15) Shri T.K.Bagul(98), Project Officer, ITDP, Bhamragad, Gadchiroli has been posted as CEO, ZP, Gadchiroli in place of Smt.Indra Mallo-Jain.\r\n\r\n16) Shri N.K.Deshmukh(96), CEO, ZP, Thane has been posted as Collector, Dhule in place of Shri B.S.Munde.\r\n\r\n17) Shri B.S.Munde(91), Collector, Dhule has been posted as Addl.Commissioner, Nashik Division, Nashik in place of Smt.Vinita Ved.\r\n\r\n18) Shri S.R.Hajare(95),DS, FCS&CP Deptt, Mantralaya, Mumbai has been posted as CEO, ZP, Thane in place of Shri N.K.Deshmukh.\r\n\r\n19) Shri S.K.Sharma(84), Commissioner, Co-operation & Registrar, Co-op.Societies, Pune has been posted as Chairman & MD, M.S.Warehousing Corpn., Pune in place of Shri Sanjay Kumar.\r\n\r\n20) Shri Vikaschandra Rastogi(95), Dy.Commissioner, Sales Tax, Mumbai has been posted as collector, Ratnagiri in place of Shri Santosh Kumar.\r\n\r\n21) Shri Santosh Kumar(94), Collector, Ratnagiri has been posted as Joint Commissioner, Sales Tax, Mumbai in place of Shri Vikaschandra Rastogi.\r\n\r\n22) Shri D.J.Jadhav(NON_CADRE_OFFICER), Addl.Commissioner, Tribal Devp., Thane has been posted as CEO, Pimpri-Chinchwad New Township Authority, Pimpri-Pune.\r\n","title":"Transferred on 05.06.2006","publishdatetime":"2006-06-07 11:01:30.0"},{"details":"1) Shri Apurva Chandra(88), Commissioner, Sugar, Pune has been posted as Director, Social Welfare, Pune in place of Shri Rajagopal Devera.\r\n\r\n2) Shri Rajagopal Devara (92), Director, Social Welfare, Pune has been posted as Commissioner, Sugar, Pune in place of Shri Apurva Chandra.\r\n\r\n3) Shri Mahesh Zagade(93), Collector, Nashik  has been posted as Director, MEDA, Pune in place of Shri Anil Diggikar.\r\n\r\n4) Smt.M.N.Kerketta (94), Member Secretary, Marathawada St.Devp.Board, Aurangabad has been posted as Addl.Commissioner, Pune Municipal Corpn., Pune in place of Shri D.S.Zagade.\r\n\r\n\r\n\r\n\r\n\r\n1990 batch has been promoted in Super Time Scale and posted on the same post except Shri Anil Diggikar.\r\n\r\n1) Shri Anil Diggikar(90), Director, MEDA, Pune has been posted as Commissioner, Co-operation & Registrar, Co-op.Societies, Pune in place of Shri S.K.Sharma.\r\n\r\n","title":"Transferred on 06.06.2006","publishdatetime":"2006-06-07 11:10:43.0"},{"details":"\r\n1) Smt.Chitkala Zutshi(71), Additional Chief Secretary & Special Commissioner, Maharashtra Sadan, New Delhi has been posted as Additional chief Secretary (SDC), GAD, Mantralaya, Mumbai in place of Shri Khot.\r\n\r\n2) Shri Apurva Chandra(88), Commissioner, Social Welfare, Pune has been posted as Secretary & Special Commissioner, Maharashtra Sadan, New Delhi in place of Smt.Chtikala Zutshi.\r\n\r\n3) Shri Jayant Kawale (80), MD, M.S.E.B.Holding Co., Mumbai has been posted as Secretary (Co-op & Mktg), Co-op, Mktg. & Textile Department, Mantralaya, Mumbai in place of Shri Sunil Porwal.\r\n\r\n4) Shri K.P.Bakshi (82), CEO, Mah.Maritime Board, Mumbai has been posted as Secretary, Food, Civil Supplies & Consumer Protection Department, Mantralaya, Mumbai-- Vacant Post.\r\n\r\n5) Shri S.K.Shrivastava (83), Secretary, Third Maharashtra Fincne Commission, Mumbai has been posted CEO, Mah.Maritime Board, Mumbai in place of Shri K.P.Bakshi.\r\n\r\n6) Shri T.C.Chandrashekhar(87), Addl.Commr, MMRDA & Director, MUTP, Mumbai has been posted Metropolition Commissioner, MMRDA, Mumbai -- Vacant Post\r\n","title":"Transferred on  17.6.2006","publishdatetime":"2006-06-19 10:33:31.0"},{"details":"1) Shri S.T.Karande(93), Chief Officer, Mumbai Repairs and Reconstruction Board, Mumbai, has been posted as Joint Secretary, Food, Civil Supplies & Consumer Protection Department, Mantralaya, Mumbai -- Vacant Post.\r\n\r\n2) Shri N.K.Deshmukh (96), Cancelorder dated 5.6.2006 and now posted as hief Officer, Mumbai Repairs and Reconstruction Board, Mumbai in place of Shri S.T.Karande.\r\n","title":"Transferred on 20.06.2006","publishdatetime":"2006-06-21 11:10:43.0"},{"details":"1) Shri U.P.Khobragade (84), Secretary (ADF), Agriculture & ADF Department, Mantralaya, Mumbai has been posted as General Manager, BEST, Mumbai in place of Shri Swadhin Kshatriya.\r\n\r\n2) Smt.Leena Mehendale(74), PS (SEO (1) (GAD, Mantralaya, Mumbai has been posted as PS (ADF), Agriculture & ADF Department, Mantralaya, Mumbai in place of Shri U.P.Khobragade.\r\n\r\n3) Shri Satish Tripathi (72) Chairman, Third Finance Commission, Mumbai has been posted as PS & SEO (1), GAD, Mantralaya, Mumbai in place of Smt. Leena Mehendale.\r\n\r\n4) Dr.J.M.Phatak (78), PS (RDD & PR), Rural Development & W.C.Department, Mantralaya, Mumbai has been posted as PS (2), Urban Development Department, Mantralaya, Mumbai in place of Shri N.B.Patil.\r\n\r\n5) Shri N.B.Patil (77) PS (2) UDD, Mantralaya, Mumbai has been posted as PS (R&R), R&FD, Mantralaya, Mumbai in place of Shri K.S.Vatsa\r\n\r\n6) Shri N.R.Rao (72), PS, Housing Department, Mantralaya, Mumbai has been posted as Vice Chairman, CIDCO, Mumbai in place of Shri Ashok Sinha.\r\n\r\n7) Shri Swadhin Kshatriya (80), General Manager, BEST, Mumbai has been posted as Secretary, Housing Department, Mantralaya, Mumbai in place of Shri N.R.Rao.\r\n\r\n8) Shri K.S.Vatsa (87), Secretary (R&R) R&FD, Mantralaya, Mumbai has been posted as Secretary (RDD&PR), RD&WC Department, Mantralaya, Mumbai in place of Dr.Phatak.\r\n\r\n9) Shri Subarth Ratho(86), Addl.Commer, BMC,  Mumbai has been posted as MD, MSEB Holding Company, Mumbai in place of Shri Jayant Kawale.\r\n\r\n10) Shri Sunil Porwal(86), then Secretary (CO-op & Marketing), C&MTD, Mantralaya, Mumbai has been posted as Secretary, Maharashtra State Human Rights Commission, Mumbai in place of Shri Amitabh Chandra.\r\n\r\n11) Shri M.Ramesh Kumar (75 ), Commissioner, FDA, Mumbai has been posted as MD, MSSIDC, Mumbai in place of Shri A.B.Kulkarni.\r\n\r\n12) Shri A.B.Kulkarni (82), MD, MSSIDC, Mumbai has been posted as Secretary, School Education & Sports Department, Mantralaya, Mumbai in place of Shri Sumit Mullick.\r\n\r\n13) Shri Sumit Mallick (82), Secretary, School Education and Sports Department, Mantralaya, Mumbai has been posted as Secretary (Social Justice), SJCA&SA Department, Mantralaya, Mumbai in place of Shri Baldev Chand.\r\n\r\n14) Shri Amitabh Chandra (74), PS, State Human Rights Commission, Mumbai has been posted as Commissioner, FDA, Mumbai in place of Shri M.Ramesh Kumar.\r\n\r\n15) Shri B.A.Gagarani (90), MD, MTDC, Mumbai has been posted as Secretary (Tourism & Cultural Affairs), Home & SJCA&SA Department, Mantralaya, Mumbai in place of Smt.Sanjeevani Kutty.\r\n\r\n16) Smt.Sanjeevani Kutty (83), Secretgary (Tourism & Cultural Affairs), Home Department & SJCA&SAD, Mantralaya, Mumbai has been posted as Secretary, State Women Commission, Mumbai --- Vacant Post\r\n","title":"Transferred on 26.6.2006","publishdatetime":"2006-06-26 15:10:56.0"},{"details":"Shri Baldev Chand (74), Principal Secretary (Social Justice), Social Justice, Cultural Affairs & Special Assistance Department, Mantralaya, Mumbai has been Retired supperannualy dated 30.6.2006.\r\n","title":"Retired as on 30.6.2006","publishdatetime":"2006-07-01 11:16:46.0"},{"details":"1) Shri Chand Goel (77), Principal Secretary, State Election Commission, Mumbai has been posted as M.D., Mah.State Textile Corpn., Mumbai -- Vacant Post.\r\n\r\n2) Shri M.Ramaswamy (82), CEO, M.S.Khadi & Village Board, Mumbai has been posted as Secretary, State Election Commission, Mumbai in place of Shri Chand Goel.","title":"Transferred on 27.07.2006","publishdatetime":"2006-07-27 16:21:38.0"},{"details":"1) Shri N.B.Patil (77), Currently on leave has been posted as Principal Secretary (Agriculture), Agriculure & ADF Department, Mantralaya, Mumbai in place of Shri V.Giriraj.","title":"Transferred on 27.7.2006","publishdatetime":"2006-07-27 16:44:10.0"},{"details":"1) Shri V.V.Poreddiwar(96), Director, Ground Water Survey Agency, Pune has been posted as Collector, Buldana in place of Shri Ganesh Thakur.\r\n\r\n2) Shri Ganesh Thakur(91), Collecor, Buldana  has been posted as Joint Secretary, Food, Civil Supplies & Consumer Protection Department, Mantralayam Mumbai-- Vacant Post.\r\n\r\n3) Shri P.B.Kalbhor(98), CEO, ZP, Gondia has been posted as CEO, ZP, Chandrapur in place of Shri Pankaj Kumar.\r\n\r\n4) Shri Pankaj Kumar (2002), CEO, ZP, Chandrapur has been posted as CEO, ZP, Jalgaon in place of Shri M.B.Gaikwad.\r\n\r\n5) Shri Saurabh Rao(2003), Assistnat Collector, Arvi, Wardha has been posted as CEO, ZP, Gonida in place of Shri P.B.Kalbhor.\r\n\r\n6) Shri Sanjeev Kumar(2003), Assistnat Collector, Jalna has been posted as CEO, ZP, Hingoli -- Vacant Post.\r\n\r\n7) Smt.Shaila A(2003), Assistnat Collector, Chiplun, Ratnagiri has been posted as CEO, ZP, Dhule in place of Shri P.N.Bhapkar.\r\n\r\n8) Smt.Jayshree Bhoj(2003), Assistnat Collector, Brahmapuri, Chandrapur has been posted as Additional Collector, Nagpur in place of Shri P.D.Karwande.\r\n\r\n9) Shri M.B.Gaikwad (1996), CEO, ZP, Jalgaon has been posted as Director, Social Welfare, Pune -- Vacant Post.\r\n\r\n10) Shri S.K.Sawant (1993), Jt.Secy, Employment & Self Emp.Department, Mumbai has been posted as CEO,M.S.Khadi & Villeage Industries Board, Mumbai in place of Shri M.Ramaswamy.\r\n\r\n11) Smt.I.A.Kundan (1996), Municipal Commissioner, Amaravati Municipal Corpn. has been posted as Deparatmental Secretary, Education Fees Committee and Controller, Examination, Mumbai -- New Post.\r\n\r\n12) Smt.Valsa Nair-Singh (1991), Addl.Commissioner, Konkan Division, Mumbai has been posted as Collector, Mumbai City, Mumbai-- Vacant Post.\r\n\r\n13) Shri B.Y.Wankhede (1995), Dy.Secretry, RDD order cancelled and he has been posted as Additional Commissioner, Konkan Division, MUmbai in place of Smt.Valsa Nair-Singh.\r\n\r\n14) Smt.Gunjan (2004), Super Numrary Assistnat Collector, Wardha has been posted as Assistant Collector, Arvi Sub Division, Dit.Wardha.\r\n\r\n15) Shri Vikram Kumar(2004), Super Numrary Assistnat Collector, Akola has been posted as Assistant Collector, Brahmapuri Sub Division, Dist.Chandrapur.\r\n\r\n16) Shri Vijay Waghmare (2004), Super Numrary Assistnat Collector, Aurangabad has been posted as Assistant Collector, Jalna Sub Division, Dist.Jalna.\r\n\r\n17) Shri Ramaswamy N (2004), Super Numrary Assistnat Collector, Ratnagiri has been posted as Assistant Collector, Chiplun Sub Division, Ratnagiri.\r\n\r\n\r\n","title":"Transferred on 28.07.2006","publishdatetime":"2006-07-29 10:50:25.0"},{"details":"(1) Shri B.P.Pandey(76), Managing Director, MPCL, Mumbai has been posted as Principal Secretary (R&R), Revenue & Forests Department, Mantralaya, Mumbai in place of Shri K.S.Vatsa.\r\n\r\n(2) Shri Parimal Singh (2004), Super Numarary Assistant Collector, Sangli has been posted as Assistant Collector, Pandharpur Sub Division, Dist. Solapur in place of Shri M.Sankarayanan.\r\n\r\n\r\n\r\n","title":"Transferred on 2.8.2006","publishdatetime":"2006-08-02 14:39:05.0"},{"details":"(1) Smt.Vinita Ved(96), Addl.Commr., Nashik Division has been posted as Collector, Hingoli in place of Shri B.R.Jadhav.\r\n\r\n(2) Shri S.S.Yeole (98), PO, ITDP, Kalwan, Nashik has been posted as Addl.Commr, Nashik Division, Nashik in place of Smt.Vinita Ved.\r\n\r\n(3) Shri M.Shankarayanan (2003), Assistant Collector, Pandharpur, Dist Solapur has been posted as CEO, ZP, Amaravati in place of Shri U.S.Rathod.\r\n\r\n(4) Shri U.S.Rathod(96), CEO, ZP, Amaravati has been posted as Commissioner, Amaravati Municipal Corporation, Amaravati -- Vacant Post.\r\n\r\n(5) Shri Niranjan Kumar Sudhanshu (2000), General Manager, Pune Municipal Transport, Pune  has been posted as Collector, Gadchiroli in place of Shri S.A.Tagade.\r\n\r\n(6) Shri S.A.Tagade(91), Collector, Gadchiroli has been posted as Additional Commissioner, Tribal Development, Nagpur -- Vacant.","title":"Transferred on 02.08.2006","publishdatetime":"2006-08-03 16:52:04.0"},{"details":"(1) Shri P.N.Bhapkar(97), CEO, ZP, Dhule has been posted as CEO, ZP, Pune -- Vacant Post.\r\n","title":"Transferred on 03.08.2006","publishdatetime":"2006-08-03 16:52:56.0"},{"details":"(1) Shri P.D.Karwande(96), The then Additional Collector, Nagpur has been posted as Collector Washim in place of Shri Saurabh Vijay.\r\n\r\n(2) Shri Saurabh Vijay(98), Collector, Washim has been posted as MD, M.S.Seeds Corporation, Akola -- Vacant Post.\r\n\r\n(3) Shri Anoop Kumar(90), DG, Kai Vasantrao Naik Agriculure Self Reliance Mission, Amaravati has been posted as Director in the Ministry of Social Justice & Empowerment, New Delhi -- on Central Deputation.","title":"Transferred on 16.8.2006 & 17.8.2006","publishdatetime":"2006-08-17 12:16:56.0"},{"details":"\r\n\r\nWISH YOU A VERY VERY HAPPY DIWALI.\r\nAND PROSPEROUS NEW YEAR. \r\n","title":"WISH YOU A VERY VERY HAPPY DIWALI 20.10.2006","publishdatetime":"2006-10-20 12:47:34.0"},{"details":"(1) Smt.Chitkala Zutshi(71), ACS (SDC), GAD, Mantralaya, Mumbai has been posted as ACS (P), GAD, Mantralaya, Mumbai in place of Shri Navin Kumar.\r\n\r\n(2) Smt.Ranjana Sinha (75), PS (Textile), Co-Op., Mktg. & Textile Deptt., Mantralaya, Mumbai has been posted as PS (SDC), GAD, Mantralaya, Mumbai in place of Smt.Zutshi.\r\n\r\n(3) Shri Ashok Sinha (75), has been posted as PS (Textile), Co-op. & Textile Deptt, Mantralaya, Mumbai in place of Smt.Ranjana Sinha.\r\n\r\n(4) Shri J.P.Dange(73), PS (Labour), IE&L Deptt, Mantralaya, Mumbai has been posted as PS (Cooperation & Marketing), Co-op,Mktg. & Textile Department, Mantralaya, Mumbai in place of Shri Jayant Kawale.\r\n\r\n(5) Shri V.Giriraj(85)has been posted as Secretary, Employment & Self Employment Department, Mantralaya, Mumbai in place of Shri Govind Swarup.\r\n\r\n\r\n","title":"Transferred on 30.08.2006","publishdatetime":"2006-09-01 11:03:39.0"},{"details":"Shri B.K.Naik (95), DS, RD&WC Deptt., Mantralaya, Mumbai has been Posted as DS (R&R), R&FD, Mantralaya, in place of Shri Khuprao.\r\n\r\n\r\n\r\nOn Promotion to Principal Secretary Grade batch 1980 & 1981.","title":"Transferred on 30.10.2006","publishdatetime":"2006-11-01 11:03:34.0"},{"details":"Government of India, Min of Finance, has invited nominations for IMF Regional Training Institute (STI) Programme 2007, Singapore vide their Letter N.F.No.19(39)2006/PMU & Trg., dated 29.9.2006,. Details about this programme  are available at official website www.finmin.nic.in.\r\n\r\nYou are requested to access the same and if contact this Department (US, General Administration Department/desk-10, 640-Main Bldg., Mantralaya, Mumbai) Tele No. 22874955 or 22793205. \r\n\t\t\t\t\t\t\t\tSd/-\r\n\t\t\t\t\t\t\tUS.GAD/X\r\n","title":"IMF Regional Training Institute (STI) Programme 2007, Singapore(8.11.2006)","publishdatetime":"2006-11-08 15:55:12.0"},{"details":"1) Shri Bipin Shrimali (92), After completion of Inter State Deputation has been Posted as Chief Officer, Mumbai Housing Area Development Board, MHADA, Mumbai in place of Shri S.O.Sonawane.\r\n\r\n2) Shri S.O.Sonawane (96), Chief Officer, Mumbai Housing Area Development Board, MHADA, Mumbai  has been Posted as Deputy Secretary (R&R), Revenue & Forests Department, Mantralaya, Mumbai in place of Shri Avinash Shubhedar.\r\n","title":"Transferred on 10.11.2006","publishdatetime":"2006-11-10 17:03:26.0"},{"details":"Filling up one post of Joint Director General (Training) in the office of Registrar General India, New Delhi.\r\n\r\nOffice of Registrar General of India, New Delhi has invited nomination for the post of Joint Director, India.\r\n\r\n\tInterested IAS Officer of 1994 to 1997 batch are requested to contact Under Secretary, General Administration Department/Desk-10, Mantralaya, Mumbai. Tel.No.022-22874955 or 22793205.\r\n\t\t\t\t\t\t\t\t\tSd/-\r\n\t\t\t\t\t\t\t\tUnder Secretary\r\nto Government of Maharashtra.\r\n","title":"Filling up one post of Joint Director General (Training) 15.11.2006","publishdatetime":"2006-11-15 10:04:37.0"},{"details":"Government of India, Ministry of Personnel, Public Grievances and Pensions has invited nominations for Mid Career Training Programme commencing from 2nd January, 2007 at IIM Ahmedabad.\r\n\r\nAll IAS Officers of 1979 & 1980 batch if interested are requested to send their willingness to this Department (Under Secretary, General Administration Department/Desk-10, Mantralaya, Mumbai). Tel.No.022-22874955 or 22793205.\r\n\t\t\t\t\t\t\t\t\tSd/-\r\n\t\t\t\t\t\t\t\tUnder Secretary\r\nto Government of Maharashtra.\r\n","title":"Mid Career Training Programme commencing from 2nd January, 2007 at IIM Ahmedabad.15.11.2006","publishdatetime":"2006-11-15 10:05:15.0"},{"details":"Filling up one post Vice Chairman, CAT, Hyearabad, Jabalpur and Principal Benches of the Tribunal.\r\n\r\nThree Vacancies of the Vice Chairman arising during second half of 2006 in the Central Administrative Tribunal.\r\n\r\nMinistry of Personnel, Public Grievances & Pensions has invited nominations vide their D.O.No.11013/28/2006/AT, dated 27.7.2006 and letter of even no. dated 23.10.2006. Fill the three posts arising during second half of 2006 one each in Hyderabad, Jabalpur and Principal Benches of the Tribunal.\r\n\r\n\tInterested IAS Officer of 1971 to 1979 batch are requested to contact to this Department. (Under Secretary, General Administration Department/Desk-10, Mantralaya, Mumbai). Tel.No.022-22874955 or 22793205.\r\n\t\t\t\t\t\t\t\t\tSd/-\r\n\t\t\t\t\t\t\t\tUnder Secretary\r\nto Government of Maharashtra.\r\n\r\n","title":"Filling up one post Vice Chairman, CAT, Hyearabad, Jabalpur and Principal Benches of the Tribunal.15.11.2006","publishdatetime":"2006-11-15 11:00:54.0"},{"details":"Filling up one post Administrative Members, CAT, Allahabad & Hyearabad, Jabalpur.\r\n\r\nTwo Vacancies of the Administrative Members in the Central Administrative Tribunal, anticipated between 1st July, 2006 & 31.12.2006.\r\n\r\nMinistry of Personnel, Public Grievances & Pensions has invited nominations vide their D.O.No.11013/28/2006/AT, dated 27.9.2006 to fill the two vacancies one at Allahabad and other at Hyderabad. \r\n\r\n\tInterested IAS Officer of 1971 to 1979 batches are requested to contact to this Department. (Under Secretary, General Administration Department/Desk-10, Mantralaya, Mumbai). Tel.No.022-22874955 or 22793205.\r\n\t\t\t\t\t\t\t\t\tSd/-\r\n\t\t\t\t\t\t\t\tUnder Secretary\r\nto Government of Maharashtra.\r\n","title":"Filling up one post Administrative Members, CAT, Allahabad & Hyearabad, 15.11.2006","publishdatetime":"2006-11-15 11:03:11.0"},{"details":"Filling up one post Deputy Chairman (Admn.)MAT, Aurangabad & Member (Admn.), MAT, Mumbai. \r\n\r\nGovt.of Maharashtra, Maharashtra Administrative Tribunal (MAT), General Administration Department/Desk-38,Mantralaya, Mumbai has invited nominations for the post of \u2013\r\n1)\tDeputy Chairman (Admn.), MAT, Aurangabad.\r\n2)\tMember (Admn.), MAT, Mumbai\r\nhaving prescribed qualification.\r\n\r\nAll IAS Officers of 1970 to 1987 batch if interested are requested to contact to this Department. (Under Secretary, General Administration Department/Desk-10, Mantralaya, Mumbai). Tel.No.022-22874955 or 22793205.\r\n\t\t\t\t\t\t\t\t\tSd/-\r\n\t\t\t\t\t\t\t\tUnder Secretary\r\nto Government of Maharashtra.\r\n","title":"Filling up one post Deputy Chairman (Admn.)MAT, Aurangabad & Member (Admn.), MAT, Mumbai. 16.11.2006","publishdatetime":"2006-11-16 11:42:16.0"},{"details":"Shri Sunil Porwal(94), Secretary, State Human Rights Commission, Mumbai has been Posted as Joint Secretary, Department of Food and Public Distribution, New Delhi.-- On Central Deputation Post.\r\n","title":"Transferred on 20.11.2006","publishdatetime":"2006-11-21 15:51:16.0"},{"details":"Indian Institute of Management of Bangalore has invited nominations for the 2 years Post Graduate Programme in Public Policy & Management (PGPPM)-2007-09.\r\nLast date of receipt of application:- 30.11.2006.\r\nInterviews in Bangalore: January-2007, First Week.\r\nInterviews in Delhi: Mid January-2007\r\nRelease of offer letters for admission End January-2007\r\n\r\nAll the related information about this will be available on following website.\r\nhttp://www.iimb.ernet.in or write to N.G.Lakshmi Narayana Rao, Administrative Officer, (PGPPM), IIMB, Bannergatta Road, Bangalore-560076.Tele FAx-080-26993265, Fax-080-26584050, Email-pgppmoffice@iimb.ernet.in.\r\n\r\n                            Sd/-\r\n                           US/GOM/X\r\n                           23.11.2006\r\n\r\n","title":"2 years Post Graduate Programme in Public Policy & Management (PGPPM)-2007-09., (23.11.2006)","publishdatetime":"2006-11-23 15:42:38.0"},{"details":"Willigness for the post of Chairman, Tobacco Board under the Department of Commerce, Guntur, Andhra Pradesh.\r\n\r\nDepartment of Personnel & Training, New has invited nominations for the post of Chairman, Tobacco Board under the Department of Commerce, Guntur, Andhra Pradesh.\r\n\r\n\r\nInterested IAS Officers of 1980 to 1990 batch who are empanelled to hold Joint Secretary or equivalent post at Central and whose State of Domicile is neither Andhra Pradesh nor Karnataka are requested to to contact to this Department. (Under Secretary, General Administration Department/Desk-10, Mantralaya, Mumbai). Tel.No.022-22874955 or 22793205.\r\n\t\t\t\t\t\t\t\t\tSd/-\r\n\t\t\t\t\t\t\t\tUnder Secretary\r\nto Government of Maharashtra.\r\n","title":"Filling the post of Chairman, Tobacco Board, Guntur, Andhra Pradesh.(24.11.2006)","publishdatetime":"2006-11-24 15:46:28.0"},{"details":"Willigness for the post of Officer on Special Duty on Kylleng Pyndengsoshiong Mining & Milling Project (KPMMP, Shillong. under the Vranium Corporation of India (UCIL)\r\n\r\nDepartment of Personnel & Training, New has invited nominations for the post of Deputy Secretary / Director, Kylleng Pyndengsoshiong Mining & Milling Project (KPMMP, Shillong under the Department of Atomic Energy.\r\n\r\nInterested IAS Officers of 1994 to 1997 batch who are prefarably from Meghalaya cadre or from the Central Service will versed with Khasi Lunguages are requested to to contact to this Department. (Under Secretary, General Administration Department/Desk-10, Mantralaya, Mumbai). Tel.No.022-22874955 or 22793205.\r\n\t\t\t\t\t\t\t\t\tSd/-\r\n\t\t\t\t\t\t\t\tUnder Secretary\r\nto Government of Maharashtra.\r\n","title":"Filling up one post Deputy Secretary / Director, Kylleng Pyndengsoshiong Mining & Milling Project (KPMMP, Shillong. (24.11.2006)","publishdatetime":"2006-11-24 15:47:05.0"},{"details":"Recruitment to one post of Advisor (Industries & Minerals) in Planning Commission on promotion / Deputation (including short-term contract basis).\r\n\r\nGovernment of India, Planning Commission, New Delhi has invited nominations for the post of Advisor (Industries & Minerals) in Planning Commission on promotion / Deputation (including short-term contract basis)in pay scale of Rs.18400-500-22400 or 22400-525-24500 which will be decided at the time of selection depending upon the qualifications and experience of officer Selected for the post.\r\n\r\nInterested IAS Officers of 1973 to 1990 batch are requested to to contact to this Department. (Under Secretary, General Administration Department/Desk-10, Mantralaya, Mumbai). Tel.No.022-22874955 or 22793205.\r\n\t\t\t\t\t\t\t\t\tSd/-\r\n\t\t\t\t\t\t\t\tUnder Secretary\r\nto Government of Maharashtra.\r\n","title":"Filling the post of Advisor (Industries and Minerals) in Planning Commission. (27.11.2006)","publishdatetime":"2006-11-27 17:10:20.0"},{"details":"Nominations for the post of Joint Secretary, Deputy Secretary, Director during the year 2007. \r\n\r\nAll IAS Officers Empanelled for Joint Secretary 1982-1990 & Deputy Secretary / Director 1991-2000 batch.\r\n\r\nDepartment of Personnel & Training, Government of India, New Delhi has invited nominations for the post of Joint Secretary, Deputy Secretary, Director during the year 2007.\r\n\r\nThe officers willing to apply are requested to contact to this Department. (Under Secretary, General Administration Department/Desk-10, Mantralaya, Mumbai). Tel.No.022-22874955 or 22793205 before 31st December, 2006. Those who fail to apply before 31st December, 2006 will not be entitled for Central Deputation.\r\n\t\t\t\t\t\t\t\t\tSd/-\r\n\t\t\t\t\t\t\t\tUnder Secretary\r\nto Government of Maharashtra.\r\n\r\n\r\nANNEXURE \u2013 III\r\n\r\nSTATIONS OUTSIDE DLEHI WHERE POSTS ARE AVAILABLE FOR DEPUTATION / APPOINTMENT DURING THE YEAR 2007.\r\n\r\nSr. No.\tNAME OF THE STATION\tLEVEL OF THE POST\r\n\t\tJS\tDIR/DS\r\n1.\t\tBhubaneshwar (Orissa)\t--\t01\r\n2.\t\tChennai (Tramilnadu)\t--\t01\r\n3.\t\tJaipur (Rajasthan)\t--\t01\r\n4.\t\tMumbai (Maharashtra)\t01\t03\r\n5.\t\tMussoorie (Uttranchal)\t--\t01\r\n6.\t\tKolkata (West Bengal)\t--\t01\r\n\r\n","title":"Nominations for the post of Joint Secretary, Deputy Secretary, Director during the year 2007.","publishdatetime":"2006-12-07 11:46:49.0"},{"details":"\r\nGovernment of India, Ministry of Personnel, Public Grievances and Pensions has invited nominations for The IDFR - Colombo Plan \u2013 One year Masters Programme in Strategy and Diplomacy in Malaysia. The details of the programme and the application from may be drawn from DoPT\u2019s Website (www.persmin.nic.in-New Circulars). \r\n\r\nInterested Officers are requested to send their willingness to this Department (Under Secretary, General Administration Department/Desk-10, Mantralaya, Mumbai). Tel.No.022-22874955 or 22793205 before 20th December, 2006 and information regarding application from (Annexure-I).. Those who fail to apply before 20th December, 2006 will not be entitled is not considered.\r\n\r\n\t\t\t\t\t\t\t\t\tSd/-\r\n\t\t\t\t\t\t\t\tJoint Secretary\r\n   to Government of Maharashtra.\r\n","title":"The IDFR - Colombo Plan \u0096 One year Masters Programme in Strategy and Diplomacy in Malaysia. Last date 20.12.2006 08.12.2006","publishdatetime":"2006-12-08 12:09:37.0"},{"details":"Government of India, Ministry of Personnel, Public Grievances and Pensions has invited nominations for Master in Public Administration in International Development Program at the John F. Kennedy School of Government, Harvard University. The details of the programme and the application from may be drawn from DoPT\u2019s Website (www.persmin.nic.in-New Circulars). \r\n\r\nInterested Officers are requested to send their willingness to this Department (Under Secretary, General Administration Department/Desk-10, Mantralaya, Mumbai). Tel.No.022-22874955 or 22793205 before 12th December, 2006 and information regarding application from (Annexure-I). Those who fail to apply before 12th December, 2006 will not be entitled is not considered.\r\n\r\n\t\t\t\t\t\t\t\t\tSd/-\r\n\t\t\t\t\t\t\t\tJoint Secretary\r\n   to Government of Maharashtra.\r\n\r\n","title":"Master in Public Administration in International Development Program at the John F. Kennedy School of Government, Harvard University. Last Date 12.12.2006 08.12.2006","publishdatetime":"2006-12-08 12:08:55.0"},{"details":"Filling the post of NREGP Cell at National Institute of Rural Development Rajendranagar, Hyderabad.\r\n\r\n\r\nNational Institute of Rural Development, Rajendranagar, Hyderabad has invited nominations of IAS Officers for the NREGP Cell having administrative experience with fair for Rural Development on deputation basis for 2 to 3 years, regulated under Rule 6 (2) (ii) of the Indian Administrative Service (Cadre) Rules, 1954.\r\n\r\nInterested IAS Officers of 1982 to 1990 batch are requested to contact to this Department. (Under Secretary, General Administration Department/Desk-10, Mantralaya, Mumbai). Tel.No.022- 22874955 or 22793205.\r\n\t\t\t\t\t\t\t\t\tSd/-\r\n\t\t\t\t\t\t\t\tUnder Secretary\r\nto Government of Maharashtra.\r\n","title":"Filling the post of NREGP Cell at National Institute of Rural Development Rajendranagar, Hyderabad.-08.12.2006","publishdatetime":"2006-12-08 12:31:10.0"},{"details":"Nominations for Exposure Programme on Micro Finance and SHGs.\r\n\r\n\r\nLBSNAA has invited nominations for Exposure programme on Micro Finance and Self \u2013 help Groups for IAS Officers at Goa from 8 to 10 January, 2007 in Collaboration and support from NABARD.\r\n\r\nInterested IAS Officers are requested to contact to this Department. (Under Secretary, General Administration Department/Desk-10, Mantralaya, Mumbai). Tel.No.022- 22874955 or 22793205.\r\n\t\t\t\t\t\t\t\t\tSd/-\r\n\t\t\t\t\t\t\t\tUnder Secretary\r\nto Government of Maharashtra.\r\n","title":"Nominations for Exposure Programme on Micro Finance and SHGs.-08.12.2006","publishdatetime":"2006-12-08 12:31:39.0"},{"details":"Applications for the post of 1) Judicial Member \u2013 1 post (reserved for OBC)2) Technical Member \u2013 1 post (unreserved)\r\n\r\nMinistry of Company Affairs, Government of India, New Delhi has invited applications for the post of 1) Judicial Member \u2013 1 post (reserved for OBC)2) Technical Member \u2013 1 post (unreserved) in prescribed format as published \u201cEmployment News / Nes papers\u201d.\r\n\r\nWilling IAS Officers of 1982-1990 batch are requested to contact to this Department. (Under Secretary, General Administration Department/Desk-10, Mantralaya, Mumbai). Tel.No.022- 22874955 or 22793205.\r\n\t\t\t\t\t\t\t\t\tSd/-\r\n\t\t\t\t\t\t\t\tUnder Secretary\r\nto Government of Maharashtra.\r\n\r\n","title":"Applications for the post of 1) Judicial Member \u0096 1 post (reserved for OBC)2) Technical Member \u0096 1 post (unreserved).-08.12.2006","publishdatetime":"2006-12-08 12:32:07.0"},{"details":"Smt.Radhika Rastogi (95), Deputy Secretary (Tourism), Home Department, Mantralaya, Mumbai  has been Posted as Chief Executive Officer, Children's Film Society India, Mumbai  -- Central Deputation Post.","title":"Transferred on 11.12.2006","publishdatetime":"2006-12-11 14:28:38.0"},{"details":"Filling the post of Joint Director, Lal Bahadur Shasrtri National Academy of Administration, Mussoorie (Joint Secretary Level.) \r\n\r\nDepartment of Personnel & Training, New Delhi has invited nominations for the post of Joint Director, Lal Bahadur Shasrtri National Academy of Administration, Mussoorie (Joint Secretary Level.) on deputation basis.\r\n\r\nInterested / willing IAS Officers of 1982-1990 batch (empanelled) are requested to contact to this Department. (Under Secretary, General Administration Department/Desk-10, Mantralaya, Mumbai). Tel.No.022- 22874955 or 22793205.\r\n\t\t\t\t\t\t\t\t\tSd/-\r\n\t\t\t\t\t\t\t\tUnder Secretary\r\nto Government of Maharashtra.\r\n","title":"Filling the post of Joint Director, Lal Bahadur Shasrtri National Academy of Administration, Mussoorie (Joint Secretary Level.) 13.12.2006","publishdatetime":"2006-12-13 14:13:02.0"},{"details":"Filling the post of Secretary, Maharashtra Public Service Commission, Mumbai.\r\n\r\nFilling up for the post of Secretary in Maharashtra Public Service Commission, Mumbai interested / willing IAS Officers of 1991-1993 batch are requested to contact to this Department. (Under Secretary, General Administration Department/Desk-10, Mantralaya, Mumbai). Tel.No.022- 22874955 or 22793205.\r\n\t\t\t\t\t\t\t\t\tSd/-\r\n\t\t\t\t\t\t\t\tUnder Secretary\r\nto Government of Maharashtra.\r\n","title":"Filling the post of Secretary, Maharashtra Public Service Commission, Mumbai. 13.12.2006","publishdatetime":"2006-12-13 14:14:00.0"},{"details":"GOVERNMENT OF MAHARASHTRA.\r\n\r\nNo.IAS-1506/CR-364/06/9,\r\nGeneral Administration Department,\r\ndated 13.12.2006\r\n\r\nTo,\r\n\tThe All IAS Officers of \r\nMaharashtra Cadre\r\n\r\nSubject:- \tLok Sabha Starred Question Dy.No.180 and 536 regarding NGO\u2019s run by IAS / IPS Officers family.\r\n\r\nSir/ Madam,\r\n\r\n\tThe Central Government, DoPT vide its letter No.28016/7/2006-AIS(III), dated 17.11.2006 has requested to furnish the following information regarding the subject mentioned above :-\r\n\r\n(a) Whether the family members of IAS and IPS are running several NGO\u2019s.\r\n\r\n\tAll IAS officers are requested to send the above information before 20.12.2006.\r\n\r\n\t\t\t\t\t\t\t\tYours,\r\n\t\t\t\t\t\t\t\tSd/-\r\n\t\t\t\t\t\t\t(Seema Vyas)\r\n\t\t\t\t\t\t\tJoint Secretary.\r\n","title":"Lok Sabha Starred Question Dy.No.180 and 536 regarding NGO\u0092s run by IAS / IPS Officers family.(Desk-9) 15.12.2006","publishdatetime":"2006-12-15 11:54:03.0"},{"details":"1) Smt.Ranjana Sinha(75), Currently on Leave  has been Posted as MD, MPCL, Mumbai --- Vacant Post.\r\n\r\n2) Shri R.C.Sagar (86), MD, MELTROM, Mumbai has been Posted as Secretary, State Human Rights Commission, Mumbai --- Vacant Post.\r\n\r\n3) Shri C.K.Anil (91), Director, Sports & Youth, Pune  has been Posted as GM, Pune Municipal Transport, Pune  --- Vacant Post.\r\n\r\n4) Shri Sanjay Sethi(92), Commissioner, Thane Muncp.Corpn, Thane has been Posted as Joint Secretary (Tourism), Home Department, Mantralaya, Mumbai --- Vacant Post.\r\n\r\n5) Shri S.S.Zende(93), Collector, MSD, Mumbai has been Posted as Collector, Thane in place of Shri N.Y.Jantre.\r\n\r\n6) Smt.V.Radha (94), Associate Professor, YASHADA, Pune has been Posted as OSD, MSRDC, Mumbai  --- Vacant Post.\r\n\r\n7) Shri N.Y.Jantre(94), Collector, Thane has been posted as Commissioner, Thane Muncp.Corpn, Thane in place of Shri Sanjay Sethi.\r\n\r\n8) Shri L.V.Deshmukh (96), Change of Order CEO, ZP, Nanded and has been Posted as Director, Sports & Youths, Pune in place of Shri C.K.Anil.\r\n\r\n9) Shri Vishwas M.Patil(96), CEO, ZP, Raigad  has been Posted as Collector, MSD, Mumbai in place of Shri S.S.Zende\r\n","title":"Transferred on 14.12.2006","publishdatetime":"2006-12-15 15:45:13.0"},{"details":"Filling the post of Jute Commissioner (Joint Secretary Level) under the Ministry of Textile in Kolkata.\r\n\r\n\r\nDepartment of Personnel & Training, New Delhi has invited nominations for the post of Jute Commissioner (Joint Secretary Level) on deputation basis.\r\n\r\nWilling IAS Officers of 1982-1990 batch empanelled to hold Joint Secretary or equivalent post at Central may contact to this Department. (Under Secretary, General Administration Department/Desk-10, Mantralaya, Mumbai). Tel.No.022- 22874955 or 22793205.\r\n\t\t\t\t\t\t\t\t\tSd/-\r\n\t\t\t\t\t\t\t\tUnder Secretary\r\nto Government of Maharashtra.\r\n","title":"Filling the post of Jute Commissioner (Joint Secretary Level) under the Ministry of Textile in Kolkata.(18.12.2006)","publishdatetime":"2006-12-18 11:49:50.0"},{"details":"1) Shri V.J.Bhosale (98), Currently on leave has been Posted as CEO, ZP, Raigad in place of Shri V.M.Patil.\r\n\r\n\r\n2) Shri M.H.Sawant(98), Deputy Secretary (Agriculture), Agri. & ADF Department, Mantralaya, Mumbai has been Posted as CEO, ZP, Buldana-- vacant post.","title":"Transferred on 15.12.2006","publishdatetime":"2006-12-18 11:52:58.0"},{"details":"1) Shri K.U.Gajbhiye (87), VC&MD, MSRTC, Mumbai  has been Posted as Addl.Commissioner, Brihanmumbai Municipal Corporation, Mumbai -- vacant post.\r\n\r\n2) Shri Eknath Dawale (97), Collector, Akola has been Posted as Collector, Latur in place of Shri Rajiv Kumar Mittal.\r\n\r\n3) Shri Rajiv Kumar Mittal (98),Collector, Latur has been Posted as Collector, Akola in place of shri Eknath Dawale.\r\n\r\n","title":"Transferred on 18.12.2006","publishdatetime":"2006-12-19 11:34:08.0"},{"details":"Training Programme to be conducted by National Institute for Financial Management, Ministry of Finance, Government of India.\r\n\r\nNational Institute for Financial Management, Ministry of Finance, Government of India is conducting training programme, Post Graduation Diploma Course in Business Management 2007-2009 which is commencing from January, 2007.\r\n\r\nWilling IAS Officers may get details of the programe on website http://www.ntfm.ac.in.\r\n\t\t\t\t\t\t\t\t\tSd/-\r\n\t\t\t\t\t\t\t\tUnder Secretary\r\nto Government of Maharashtra.\r\n\r\n","title":"Training Programme to be conducted by National Institute for Financial Management. 28.12.2006","publishdatetime":"2006-12-28 14:01:03.0"},{"details":"21st Course for Senior Executives on \u201cExcellence in Leadership\u201d at National Institute of Advanced Studies (NIAS), Bangalore during 21-27 January-2007.\r\n\r\n\r\nNational Institute of Advanced Studies (NIAS), Bangalore organising its 21st Course for Senior Executives in Government and Private Sector during 21-27 January-2007.\r\n\r\nInterested IAS Officers are requested to contact Director, National Institute of Advanced Studies, Indian Institute Campus, Bangalore-560012 (Tel-080-23604351, 23606594, 23602760, Fax-23606634, Email:-niasoff@nias.iisc.ernet.in. \r\n\r\nDetails available on Website:www.iisc.ernet.in/nias or www.nias.res.in.\r\n\t\t\t\t\t\t\t\t\tSd/-\r\n\t\t\t\t\t\t\t\tUnder Secretary\r\nto Government of Maharashtra.\r\n\r\n","title":"21st Course for Senior Executives on \u0093Excellence in Leadership\u0094 at National Institute of Advanced Studies (NIAS), Bangalore during 21-27 January-2007. 28.12.2006","publishdatetime":"2006-12-28 14:01:34.0"},{"details":"Willingness for the post of Additional Director (Joint Secretary Level), Central Research Institute, Kasuali on Deputation basis.\r\n\r\nDepartment of Personnel & Training, Government of India, New Delhi has invited nominations for the post of Additional Director (Joint Secretary Level), Central Research Institute, Kasauli on deputation bsis in pay scale of (Rs.18400-22400).\r\n\r\nInterested IAS Officers of 1982-1990 batch are requested to send their willingness before 10.1.2007 to Under Secretary, General Administration Department/Desk-10, Mantralaya, Mumbai. (Tel.No.022-22874955 or 22793205).\r\n\r\n\t\t\t\t\t\t\t\t\tSd/-\r\n\t\t\t\t\t\t\t\tUnder Secretary\r\nto Government of Maharashtra.\r\n\r\n","title":"Willingness for the post of Additional Director (Joint Secretary Level), Central Research Institute, Kasuali on Deputation basis.5.1.2007","publishdatetime":"2007-01-05 15:54:10.0"},{"details":"Willingness for the post of Chief Vigilance Officers in Central Public Sector Undertakings during the year 2007.\r\n\r\nDepartment of Personnel & Training, Government of India, New Delhi has invited nominations for the post of Chief Vigilance Officers in Central Public undertakings (which are post under the Central Staffing Scheme) during the year, 2007 in the pay scale of Rs.18400-22400/-. The details of this are also available on DiPT\u2019s web site at URL http://persmin.nic.in.\r\n\r\nInterested IAS Officers of 1982-1990 batch are requested to apply in prescribed proforma I & II & submit to Under Secretary, General Administration Department/Desk-10, Mantralaya, Mumbai before 20th January, 2007. (Tel.No.022-22874955 or 22793205).\r\n\t\r\n\t\t\t\t\t\t\t\t\tSd/-\r\n\t\t\t\t\t\t\t\tUnder Secretary\r\nto Government of Maharashtra.\r\n","title":"Willingness for the post of Chief Vigilance Officers in Central Public Sector Undertakings during the year 2007., 5.1.2007","publishdatetime":"2007-01-05 15:54:47.0"},{"details":"Filling up the post of Director General (Akashwani), New Delhi by Promotion / Deputation basis.\r\n\r\nBroadcasting Corporation of India, Prasar Bharti, Prasar Bharati Secretariat has invited nominations for post of Director General (Akashwani) in pay scale of (Rs.24050-650-26000). The details of this post are also available an Website of Director (EPM), Director General-Air at (www.allindiaradio.org, www.allindiaradio.org) \r\n\r\nInterested IAS Officers of 1982-1990 batch and also empanelled as Joint Secretary to the regular service and having experience in Media or Mass communications or Public Administration may apply in prescribed format and forward to Under Secretary, General Administration Department/Desk-10, Mantralaya, Mumbai before 10th February, 2007. (Tel.No.022-22874955 or 22793205).\r\n\r\n\t\t\t\t\t\t\t\t\tSd/-\r\n\t\t\t\t\t\t\t\tUnder Secretary\r\nto Government of Maharashtra.\r\n\r\n","title":"Filling up the post of Director General (Akashwani), New Delhi by Promotion / Deputation basis., 5.1.2007","publishdatetime":"2007-01-05 15:55:28.0"},{"details":"Willingness for the post of Director of National Institute of Fashion Technology, Gandhinagar. \r\n\r\nNational Institute of Fashion Technology, Ministry of Textile, Government of India a college of Design, Management & Technology has invited nominations for the post of Director for its Gandhinagar Centre to be filled by deputation in grade of Deputy Secretary / Director.\r\n\r\nInterested & eligible IAS Officers of 1982-1990 batch may contact to Under Secretary, General Administration Department/Desk-10, Mantralaya, Mumbai before 20th January, 2007. (Tel.No.022-22874955 or 22793205).\r\n\r\n\t\t\t\t\t\t\t\t\tSd/-\r\n\t\t\t\t\t\t\t\tUnder Secretary\r\nto Government of Maharashtra.\r\n","title":"Willingness for the post of Director of National Institute of Fashion Technology, Gandhinagar. (9.1.2007)","publishdatetime":"2007-01-09 16:50:17.0"},{"details":"6th Post Graduate Programme in Public Policy & Management during 2007-09 at the centre for Public Policy, Indian Institute of Management at Bangalore.\r\n\r\nThe Department of Personnel & Training is sponsoring a Post Graduate Programme in Public Policy & Management (PGPPM) at the centre for Public Policy, Indian Institute of Management, Bangalore. The details are also available on Website of IIM, Bangalore viz. http://www.iimb.ernet.in.\r\n\r\nInterested IAS Officers of 1987-2000 batch may contact to Under Secretary, General Administration Department/Desk-10, Mantralaya, Mumbai before 20th January, 2007. (Tel.No.022-22874955 or 22793205).\r\n\r\n\t\t\t\t\t\t\t\t\tSd/-\r\n\t\t\t\t\t\t\t\tUnder Secretary\r\nto Government of Maharashtra.\r\n","title":"6th Post Graduate Programme in Public Policy & Management during 2007-09 at the centre for Public Policy, Indian Institute of Management at Bangalore.. (9.1.2007)","publishdatetime":"2007-01-09 16:50:42.0"},{"details":"CII Naoroji Godrej Centre of Excellence has informed about their fourth coming Management Development Programmes useful for appropriate officials from Government of Maharashtra which are being held in January and February, 2007.\r\n\r\nDetails of the programme of are also available on Website: www.ciionline.org.\r\n\r\nIntrested IAS officers may contact Under Secretary, General Administration Department/Desk-10, Mantralaya, Mumbai before 20th January, 2007. (Tel.No.022-22874955 or 22793205).\r\n\r\n\t\t\t\t\t\t\t\t\tSd/-\r\n\t\t\t\t\t\t\t\tUnder Secretary\r\nto Government of Maharashtra.\r\n","title":"CII Naoroji Godrej Centre of Excellence, Management Development Programmes (18.1.2007)","publishdatetime":"2007-01-18 15:36:55.0"},{"details":"1) Smt.Aana Dani(76), Principal Secretary & Commissioner (FW), Public Health Department, Mantralaya, Mumbai has been Posted as Principal Secaretary, Women & Child Welfare Department, Mantralaya, Mumbai in place of Smt.Vandana Krishna due to long leave.\r\n\r\n2) Shri Amitabh Joshi (88), Deputy Secretary (EGS), Rural Development & Water Conservation Department, Mantralaya, Mumbai  has been Posted as Managing Director, M.S.Fishries Development Corporation, Mumbai -- vacant post.\r\n\r\n3) Shri Rajeev Kumar Mittal (98), Collector, Latur has been posted as Deputy Secretary (EGS), Rural Development & Water Conservation Department, Mantralaya, Mumbai  in place of Shri Amitabh Joshi.\r\n","title":"Transferred on 25.01.2007","publishdatetime":"2007-01-29 16:38:33.0"},{"details":"Willingness for the post of Executive Director (South), Food Corporation of India at Chennai.\r\n\r\nDepartment of Personnel & Training, New Delhi has invited nominations to fill the post Executive Director (South), Food Corporation of India at Chennai.\r\n\r\nInterested IAS Officers who are empanelled to hold Joint Secretary or equivalent post at Centre may contact to Under Secretary, General Administration Department/Desk-10, Mantralaya, Mumbai before 1st February, 2007. (Tel.No.022-22874955 or 22793205).\r\n\r\n\t\t\t\t\t\t\t\t\tSd/-\r\n\t\t\t\t\t\t\t\tUnder Secretary\r\nto Government of Maharashtra.\r\n","title":"Willingness for the post of Executive Director (South), Food Corporation of India at Chennai. 29.1.2007","publishdatetime":"2007-01-29 16:28:04.0"},{"details":"Willingness for the post of Director, South Zone Cultural Centre on deputation basis.\r\n\r\nMinistry of Culture, Government of India, New Delhi has invited nominations for the post of Director, South Zone Cultural Centre (Deputy Secretary / Director to the Government of India Level) on deputation basis.\r\n\r\nInterested IAS Officers of 1982-1990 batch who are interested in art and culture are requested to send their willingness to contact to Under Secretary, General Administration Department/Desk-10, Mantralaya, Mumbai. (Tel.No.022-22874955 or 22793205).\r\n","title":"Willingness for the post of Director, South Zone Cultural Centre on deputation basis. 29.1.2007","publishdatetime":"2007-01-29 16:28:46.0"},{"details":"1) Shri M.N.Kokate (91), Commissioner, Navi Mumbai Municipal Corporation, Navi Mumbai has been Posted as Vice Chairman & Managing Director, M.S.Road Transport  Corporation, Mumbai -- vacant post.\r\n\r\n2) Shri V.S.Nahata (96), Joint MD, M.S.Cotton Growers Marketing Federation, Mumbai  has been Posted as Commissioner, Navi Mumbai Municipal Corporation, Navi Mumbai in place of Shri Kokate.","title":"Transferred on 3.2.2007","publishdatetime":"2007-02-05 10:14:17.0"},{"details":"Willingness for the post of Controller of Administration in Space Application Centre, Ahmedabad on deputation basis.\r\n\r\nDepartment of Space, Bangalore has invited nominations for the post of Controller of Administration in Space Application Centre, Ahmedabad at the level of Joint Secretary (Rs.18400-22400/-) or Director (Rs.14300-18300/- / Rs.15100-18300/-). The maximum age limit is 56 years.\r\n\r\nInterested IAS Officers of 1982-1993 batch are request to contact to Under Secretary, General Administration Department/Desk-10, Mantralaya, Mumbai. (Tel.No.022-22874955 or 22793205).\r\n\r\n\t\t\t\t\t\t\t\t\tSd/-\r\n\t\t\t\t\t\t\t\tUnder Secretary\r\nto Government of Maharashtra.\r\n","title":"Willingness for the post of Controller of Administration in Space Application Centre, Ahmedabad on deputation basis. 5.2.2007","publishdatetime":"2007-02-05 12:24:22.0"},{"details":"Willingness for the post of Director General, Investigation and Registration (DGI&R), Ministry of Company Affairs on deputation basis.\r\n\r\nMinistry of Company Affairs, Government of India has invited nominations for the post of Director General, Investigation and Registration (DGI&R), Ministry of Company Affairs on deputation basis in pay Scale of Rs, (18400-22400/-).\r\n\r\nInterested IAS Officers of 1982-1990 batch are request to apply in prescribed proforma which will be published in \u201cEmployment News\u201d or may contact to Under Secretary, General Administration Department/Desk-10, Mantralaya, Mumbai. (Tel.No.022-22874955 or 22793205).\r\n\r\n\t\t\t\t\t\t\t\t\tSd/-\r\n\t\t\t\t\t\t\t\tUnder Secretary\r\nto Government of Maharashtra.\r\n","title":"Willingness for the post of Director General, Investigation and Registration (DGI&R), Ministry of Company Affairs on deputation basis. 5.2.2007","publishdatetime":"2007-02-05 12:24:45.0"},{"details":"Programme on Scientific Spare parts management from 9th to 10th February, 2007 conducted by CII Naoroji Godrej centre of Excellence.\r\n\r\nCII Naoroji Godrej Centre of Excellence is organisng programme on Scientific Spare parts Management during 9th 10 10th February, 2007. Interested IAS Officers may contact to Under Secretary, General Administration Department/Desk-10, Mantralaya, Mumbai. (Tel.No.022-22874955 or 22793205).\r\n\r\n\t\t\t\t\t\t\t\t\tSd/-\r\n\t\t\t\t\t\t\t\tUnder Secretary\r\nto Government of Maharashtra.\r\n","title":"Programme on Scientific Spare parts management from 9th to 10th February, 2007 conducted by CII Naoroji Godrej centre of Excellence. 9.2.2007","publishdatetime":"2007-02-09 15:58:48.0"},{"details":"TQM in Training Institutions \u2013 Material for Newsletter 2007.\r\n\r\nLal Bahadur Academy is publishing Newsletter entitled \u201cQuality Government\u201d containing the Quality Initiatives specially in Government Offices. For this they need material which is relevant to experiences in bringing Quality in organisation, implementation of Action Plan, quotable Quotes on Quality Quality humour, snippets etc. \r\n\r\nWilling officers who are interested to send their conttibution before 20th February, 2007. For more details contact to Under Secretary, General Administration Department/Desk-10, Mantralaya, Mumbai. (Tel.No.022-22874955 or 22793205).\r\n\r\n\t\t\t\t\t\t\t\t\tSd/-\r\n\t\t\t\t\t\t\t\tUnder Secretary\r\nto Government of Maharashtra.\r\n","title":"TQM in Training Institutions \u0096 Material for Newsletter 2007. [12.2.2007]","publishdatetime":"2007-02-12 12:33:57.0"},{"details":"Nomination for the deputation of newly created State of Uttaranchal.\r\n\r\nGovernment of Uttarakhand Secretariat, Dehradun has invited nominations for the deputation of newly created State of Uttaranchal.\r\n\r\nThe officers 1991-1998 batch Willing to apply are requested to sent their bio-data\u2019s or required more details contact to Under Secretary, General Administration Department/Desk-10, Mantralaya, Mumbai. (Tel.No.022-22874955 or 22793205).\r\n\r\n\t\t\t\t\t\t\t\t\tSd/-\r\n\t\t\t\t\t\t\t\tUnder Secretary\r\nto Government of Maharashtra.\r\n\r\n","title":"Nomination for the deputation of newly created State of Uttaranchal. [15.2.2007]","publishdatetime":"2007-02-15 10:59:13.0"},{"details":"1) Shri Jayant Kawale (81), Principal Secretary (Energy) has been posted as Joint Secretary, Ministry of Power, New Delhi---- Central Deputation.\r\n\r\n2) Shri Sunil Soni (81), Director, Municipal Administration, Mumbai has been posted as Principal Secretary (Reforms), Finance Department, Mantralaya, Mumbai---- vacant Post.","title":"Transferred on 13.2.2007","publishdatetime":"2007-02-15 11:01:49.0"},{"details":"Willingness for the post of Director-cum-Member Secretary, South Zone Cultural Centre, Thanjavur on deputation basis.\r\n\r\nGovernor\u2019s Secretariat, Raj Bhawan, Chennai has invited nominations for the post of Director-cum-Member Secretary, South Zone Cultural Centre, Thanjavur at the level of Deputy Secretaries / Directors of the Government of India [Rs. (18400-500-22400/-).\r\n\r\nInterested IAS Officers of 1982-1990 batch are request to send their Bio-data and contact to Under Secretary, General Administration Department/Desk-10, Mantralaya, Mumbai immediately. (Tel.No.022-22874955 or 22793205).\r\n\r\n\t\t\t\t\t\t\t\t\tSd/-\r\n\t\t\t\t\t\t\t\tUnder Secretary\r\nto Government of Maharashtra.\r\n","title":"Willingness for the post of Director-cum-Member Secretary, South Zone Cultural Centre, Thanjavur 20.2.2007","publishdatetime":"2007-02-20 11:12:08.0"},{"details":"1) Smt. Chandra Iyengar (73), Principal Secretary (A&S) Home Department, Mantralaya, Mumbai has been posted as Principal Secretary (Public Health & Family Welfare), Public Health Department, Mantralaya, Mumbai in place of Shri V.S.Singh.\r\n\r\n2) Smt.Aana Dani (76), Principal Secretary, Women & Child Welfare Department, Mantralaya, Mumbai has been posted as Principal Secretary (A&S), Home Department, Mantralaya, Mumbai in place of Smt.Chandra Iyengar.\r\n\r\n3) Shri V.S.Singh (84), Secretary, Public Health Department, Mantralaya, Mumbai has been posted as Secretary, Women & Child Welfare Department, Mumbai in place of Smt.Anna Dani.\r\n\r\n\r\n","title":"Transferred on 15.2.2007","publishdatetime":"2007-02-20 12:45:05.0"},{"details":"Willingness for the post of Executive Director, Tobbaco Board, Guntur, Andhra Pradesh on the deputation basis.\r\n\t\r\nDepartment of Personnel & Training, New Delhi has invited nominations for the post of Executive Director, Tobbaco Board, Guntur, Andhra Pradesh at the level of Director Rank.\r\n\tInterested officers of 1991-1993 Batch are requested to send their Bio-Data & contact Under Secretary, General Administration Department, Mantralaya, Mumbai immediately. (Tel.No.022-22874955 or 22793205).\r\n\r\n\t\t\t\t\t\t\t\t\tSd/-\r\n\t\t\t\t\t\t\t\tUnder Secretary\r\n\t\t\t\t\t\tto Government of Maharashtra.\r\n","title":"Willingness for the post of Executive Director, Tobbaco Board, Guntur, Andhra Pradesh on the deputation basis. (3.3.2007)","publishdatetime":"2007-03-03 16:14:26.0"},{"details":"Willingness for the post of Regional Director, Staff Selection Commission, Central Region, Allahabad on the deputation basis.\r\n\tDepartment of Personnel & Training, New Delhi has invited nominations for the post of Regional Director, Staff Selection Commission, Central Region, Allahabad at the level of Deputy Secretary/Director Rank.\r\n\tInterested officers of 1991-1993 Batch are requested to send their Bio-Data & contact Under Secretary, General Administration Department, Mantralaya, Mumbai immediately. (Tel.No.022-22874955 or 22793205).\r\n\r\n\t\t\t\t\t\t\t\t\tSd/-\r\n\t\t\t\t\t\t\t\tUnder Secretary\r\n\t\t\t\t\t\tto Government of Maharashtra.\r\n","title":"Willingness for the post of Regional Director, Staff Selection Commission, Central Region, Allahabad on the deputation basis. (3.3.2007)","publishdatetime":"2007-03-03 16:14:59.0"},{"details":"Willingness for the post of Counsel General, Geddah on the deputation basis.\r\n\tDepartment of Personnel & Training, New Delhi has invited nominations for the post of Counsel General, Jeddah under the Ministry of External Affairs at the level of Islamic Faith in the rank of Director.\r\n\tInterested officers of 1991-1993 Batch are requested to send their Bio-Data & contact Under Secretary, General Administration Department, Mantralaya, Mumbai immediately. (Tel.No.022-22874955 or 22793205).\r\n\r\n\t\t\t\t\t\t\t\t\tSd/-\r\n\t\t\t\t\t\t\t\tUnder Secretary\r\n\t\t\t\t\t\tto Government of Maharashtra.\r\n","title":"Willingness for the post of Counsel General, Geddah on the deputation basis. (3.3.2007)","publishdatetime":"2007-03-03 16:15:38.0"},{"details":"Willingness for the post of Secretary, Animal Welfare Board of India, Chennai on the transfer/deputation basis.\r\n\r\n\tM/o. Environment & Forests, Animal Welfare Divison, New Delhi has invited nominations for the post of Secretary, Animal Welfare Board of India, Chennai in the pay scale of Rs.12000-375-16500 from the suitable officers for State Governments holding posts in the identical scale or in the scale of Rs.10000-325-15200 with five years service in the grade, having wide experience in administration & with a capacity to organize meetings, seminars, conferences etc. Candidate will not be allow to withdraw subsequently.\r\n\tInterested officers of 1994-1997 Batch are requested to send their Bio-Data & contact Under Secretary, General Administration Department, Mantralaya, Mumbai immediately. (Tel.No.022-22874955 or 22793205).\r\n\r\n\t\t\t\t\t\t\t\t\tSd/-\r\n\t\t\t\t\t\t\t\tUnder Secretary\r\n\t\t\t\t\t\tto Government of Maharashtra.\r\n","title":"Willingness for the post of Secretary, Animal Welfare Board of India, Chennai on the transfer/deputation basis.(3.3.2007)","publishdatetime":"2007-03-03 16:19:21.0"},{"details":"1) Shri S.S.Hussain(76), Principal Secretary (Revenue(, Revenue & Forests Department, Mantralaya, Mumbai has been posted as Chairman, Jawaharlal Nehru Port Trust, Mumbai-----vacant post.\r\n\r\n2) Shri Bhagwan Sahai (84), Currently on leave  has been posted as MD, Managing Director, Mahatma Phule Backward Class Development Corporation, Mumbai ----- Vacant Post.","title":"Transferred on 6.3.2007","publishdatetime":"2007-03-07 10:37:07.0"},{"details":"GOVERNMENT OF MAHARASHTRA\r\n\r\n\r\n\t\tNo.MIS-1007/CR-19/2007/X,\r\n\t\t\t\t\tGeneral Administration Department,\r\n\t\t\t\t\tMantralaya, Mumbai \u2013 400 032.\r\n\t\t\t\t\tDate :-. 13.3.2007.\r\n\r\nTo,\r\n\tAll IAS Officer\r\n\t[Maharashtra Cadre]\r\n\r\nSubject :\tCirulation of Civil List 2007.\r\n\r\n\r\nDear Sir / Madam,\r\n\r\n\r\n\tI am pleased to inform you that the list of IAS officers of Maharashtra Cadre (CIVIL LIST \u2013 2007) is published. The same is available for circulation. Two copies of CIVIL LIST \u2013 2007 [one for personal use & one for office use] will be provided to each officer. \r\n\r\nIt is come to notice that sometimes the copies of the CIVIL LIST get misplaced in transit. Therefore, you are requested to direct your office messenger deputed to distribute tapal in Mantralaya to collect the copies, along with your letter.\r\n\r\n\r\n\t\t\t\t\t\t\tYours Sincerely,\r\n\r\n\t\t\t\t\t\t\t\tSd/-\r\n\r\n\t\t\t\t\t\t[ Seema Vyas]\r\n\t\t\t\t\tJoint Secretary to Government\r\n\t\t\t\tTel No.022-22023461, Fax 22874955.\r\n\t\t\t      Email :-js-gad-mah@nic.in\r\n","title":"CIRCULATION OF CIVIL LIST-2007 (13.2.2007)","publishdatetime":"2007-03-13 16:02:14.0"},{"details":"Subject :- Extension of Special Concessins/facilities for Central Government Employees working in Kashmir Valley.\r\n\t\r\nDepartment of Personnel & Training, New Delhi has issued above reference letter on 8.12.2006.  All of the details regarding above mentioned subject is available on the website mentioned below.\r\nhttp://www.persmin.nic.in/dopt/\r\nAll IAS officers requested to see above site for information & necessary action.\r\n\r\n\t\t\t\t\t\t\t\t\tSd/-\r\n\t\t\t\t\t\t\t\tUnder Secretary\r\n\t\t\t\t\t\tto Government of Maharashtra.\r\n","title":"Extension of Special Concessins/facilities for Central Government Employees working in Kashmir Valley.(16.3.2007)","publishdatetime":"2007-03-16 12:16:51.0"},{"details":"Willingness for the post of Counsel General, Geddah on the deputation basis.\r\n\t\r\n\tWith reference to message dated 3.2.2007 for Willingness for the post of Counsel General, Geddah on the deputation basis.\r\n\r\nInterested officers of 1991-1993 Batch are requested to send their Bio-Data & contact Under Secretary, General Administration Department, Mantralaya, Mumbai immediately. (Tel.No.022-22874955 or 22793205).\r\n\r\n\t\t\t\t\t\t\t\t\tSd/-\r\n\t\t\t\t\t\t\t\tUnder Secretary\r\n\t\t\t\t\t\t            to Government of Maharashtra.\r\n","title":"Willingness for the post of Counsel General, Geddah on the deputation basis. (17.3.2007)","publishdatetime":"2007-03-17 15:03:58.0"},{"details":"Willingness for the post of Joint Secretary in the Department of Atomic Energy in Mumbai on the deputation basis.\r\n\r\n\tDepartment of Personnel & Training, New Delhi has invited nominations for the post of Joint Secretary in the Department of Atomic Energy in Mumbai at the level Joint Secretary or equivalent posts at the centre in the pay scale [Rs.18400-500-22400].\r\n\r\nInterested officers of 1982-1990 Batch are requested to send their Bio-Data & contact Under Secretary, General Administration Department, Mantralaya, Mumbai before 5.4.2007. (Tel.No.022-22874955 or 22793205).\r\n\r\n\t\t\t\t\t\t\t\t\tSd/-\r\n\t\t\t\t\t\t \t\tUnder Secretary\r\n\t\t\t\t\t\t           to Government of Maharashtra.\r\n","title":"Willingness for the post of Joint Secretary in the Department of Atomic Energy in Mumbai. (17.3.2007)","publishdatetime":"2007-03-17 15:04:36.0"},{"details":"Willingness for the post of Chief Executive Officer, Khadi Village Industries Commission under M/o. Agro & Rural Industries in Mumbai on the deputation basis.\r\n\r\n\tDepartment of Personnel & Training, New Delhi has invited nominations for the post of Chief Executive Officer, Khadi Village Industries Commission under M/o. Agro & Rural Industries in Mumbai at the level Joint Secretary or equivalent posts at the centre in the pay scale [Rs.18400-500-22400].\r\nInterested officers of 1982-1990 Batch are requested to send their Bio-Data & contact Under Secretary, General Administration Department, Mantralaya, Mumbai before 5.4.2007. (Tel.No.022-22874955 or 22793205).\r\n\r\n\t\t\t\t\t\t\t\t\tSd/-\r\n\t\t\t\t\t\t\t\tUnder Secretary\r\n\t\t\t\t\t\t              to Government of Maharashtra.\r\n","title":"Willingness for the post of Chief Executive Officer, Khadi Village Industries Commission under M/o. Agro & Rural Industries in Mumbai (17.3.2007)","publishdatetime":"2007-03-17 15:05:10.0"},{"details":"Willingness for the post of Controller of Administration, Space Applications Centre[SAC], Ahmedabad on the deputation basis.\r\n\t\r\nWith reference to message dated 5.2.2007 for willingness for the post of Controller of Administration, Space Applications Centre[SAC], Ahmedabad on the deputation basis.\r\n\r\n\tDepartment of Space, Banglore has invited nominations for the post of Controller of Administration, Space Applications Centre[SAC], Ahmedabad at the level Joint Secretary or Director at the centre.\r\nInterested officers of 1982-1990 Batch are requested to send their Bio-Data & contact Under Secretary, General Administration Department, Mantralaya, Mumbai immediately. (Tel.No.022-22874955 or 22793205).\r\n\r\n\t\t\t\t\t\t\t\t\tSd/-\r\n\t\t\t\t\t\t\t\tUnder Secretary\r\n\t\t\t\t\t\t              to Government of Maharashtra.\r\n","title":"Willingness for the post of Controller of Administration, Space Applications Centre[SAC], Ahmedabad (17.3.2007)","publishdatetime":"2007-03-17 15:05:41.0"},{"details":"Subject :- IMF Institute Programme 2007.\r\nMinistry of Finance, Department of Economic Affairs has issued above reference letter on 28.2.2007.  All of the details regarding above mentioned subject on below mentioned website.\r\nwww.persmin.nic.in/dopt/\r\nAll IAS officers requested to see above site for information & necessary action.\r\n\r\n\t\t\t\t\t\t\t\t\tSd/-\r\n\t\t\t\t\t\t\t\tUnder Secretary\r\n\t\t\t\t\t\tto Government of Maharashtra.\r\n","title":"IMF Institute Programme 2007. (17.3.2007)","publishdatetime":"2007-03-17 15:06:23.0"},{"details":"Subject :- Good Urban Governance & Project Planning and Management an International training programme.\r\nAus-HS India will conduct International training Programme on 29th April to 12th May, 2007 has issued above reference letter on 9.3.2007.  All of the details regarding above mentioned subject on below mentioned website.\r\nhttp://www.aushs.com/course-feb-2007\r\nAll IAS officers requested to see above site for information & necessary action.\r\n\r\n\t\t\t\t\t\t\t\t\tSd/-\r\n\t\t\t\t\t\t\t\tUnder Secretary\r\n\t\t\t\t\t\tto Government of Maharashtra.\r\n","title":"Good Urban Governance & Project Planning and Management an International training programme. (17.3.2007)","publishdatetime":"2007-03-17 15:06:57.0"},{"details":"Subject :- Calender of Training programmes for the year 2007-2008 of the National Institute of Financial Management, Faridabad.\r\nNational Institute of Financial Management, Faridabad has issued above reference letter on 23.2.2007.  All of the details regarding above mentioned subject on below mentioned website.\r\nwww.nifm.ac.in\r\nAll IAS officers requested to see above site for information & necessary action.\r\n\r\n\t\t\t\t\t\t\t\t\tSd/-\r\n\t\t\t\t\t\t\t\tUnder Secretary\r\n\t\t\t\t\t\t            to Government of Maharashtra.\r\n","title":"Subject :- Calender of Training programmes for the year 2007-2008 of the National Institute of Financial Management, Faridabad. (17.3.2007)","publishdatetime":"2007-03-17 15:07:37.0"},{"details":"Willingness for the post of Director, Tea Promotion [Grade-I] in Tea Board\u2019s Office at London on transfer on deputation basis.\r\n\r\n\tMinistry of Commerce & Industry, Department of Commerce, New Delhi has invited nominations for the post of Director, Tea Promotion(Grade-I) at London in the pay scale [Rs.12750-16500] with at least 5 years service in the pay-scale of Rs.10,000-15,200.\r\n\r\nInterested officers of 1994-1998 Batch are requested to send their Bio-Data & contact Under Secretary, General Administration Department, Mantralaya, Mumbai before 10.04.2007. (Tel.No.022-22874955 or 22793205).\r\n\r\n\t\t\t\t\t\t\t\t\tSd/-\r\n\t\t\t\t\t\t\t\tUnder Secretary\r\n\t\t\t\t\t\t              to Government of Maharashtra.\r\n","title":"Willingness for the post of Director, Tea Promotion [Grade-I] in Tea Board\u0092s Office at London (30.3.2007)","publishdatetime":"2007-03-30 16:19:19.0"},{"details":"1) Shri Rahul Asthana (78), has been posted as Principal Secretary (Energy), Industries, Energy & Labour Department, Mantralaya, -----vacant post.","title":"Transferred on 29.03.2007","publishdatetime":"2007-04-02 16:31:15.0"},{"details":"Shri K.S.Vatsa (87), Secretary (RDD& PR), Rural Development & Water Conservation Department, Mantralaya, Mumbai has been appointed as Early Recovery Co-ordinator, UNDP, Manila, Philippines, Foreign Assignment for 1 year.","title":"Transferred on 2.4.2007","publishdatetime":"2007-04-02 16:33:26.0"},{"details":"Shri Nitin Kareer(88), Commissioner, Pune Municipal Corporation, Pune has been transferred as Divisional Commissioner, Pune Division, Pune. ------- Vacant Post.","title":"Transferred on 03.04.2007.","publishdatetime":"2007-04-04 11:33:05.0"},{"details":"Smt.Vandana Krishna (85), currently on leave has been transferred as Commissioner (Family Welfare), Public Health Department, Mantralaya, Mumbai. ------- Vacant Post.","title":"Transferred on 9.4.2007","publishdatetime":"2007-04-10 14:21:46.0"},{"details":"1) Smt.J.Sankaran (72), PS, H&TE Department, Mantralaya, Mumbai has been Promoted as Additional Chief Secretary, Higher & Technical Education Department, Mantralaya, Mumbai.\r\n\r\n2) Smt.Neela Satyanarayan (72), PS (Forests), R&F Department, Mantralaya, Mumbai has been Promoted as Additional Chief Secretary (Forests), Revenue & Forests Department, Mantralaya, Mumbai.","title":"Promotion on  ACS (13.04.2007)","publishdatetime":"2007-04-16 10:19:13.0"},{"details":"S/Shri A.B.Kulkarni, Secy, School Education & Sports Deptt., S.K.Goel, Div.Commr, Amaravati Division, V.K.Kanade, Secretary (Expenditure), Finance Department, V.K.Jairath, Secretary (Industries), Industries, Energy & Labour Department & Shri K.P.Bakshi, Secretary, Food, Civil Supplies & Consumer Protection Department, Department, Mantralaya, Mumbai has been Promoted as Principal Secretary Grade in Upgraded this Post as Principal Secretary Grade  and Appoinment As Principal Secretary in above mentioned posts. ","title":"Promotion on Principal Secretary Grade (1982 batch) (16.4.2007)","publishdatetime":"2007-04-17 10:39:26.0"},{"details":"1) Shri Deepak Kapoor, Jt.MD, CIDCO has been Promoted Super Time scale in Same post.\r\n\r\n2) Shri S.A.Tagade, Addl.Commr, Tribal Devp. Nagpur has been Promoted Super Time scale and posted as Chairman, NIT, Nagpur -- Vacant post.\r\n\r\n3) Smt.Valsa R. Nair-Singh, Collector, Mumbai City has been Promoted Super Time scale and posted as Divisional Commissioner, Konkan Division, Mumbai -- Vacant Post.\r\n\r\n4) Shri M.N.Kokate, VC&MD, MSRTC has been Promoted Super Time scale in Same post.\r\n\r\n5) Shri S.G.Kinkar, Commr, Tribal Education and Research Institute, Pune has been Promoted Super Time scale in Same post.\r\n\r\n6) Shri M.V.Sangle, Addl.Div.Commr., Aurangabad Division, Aurangabad has been Promoted Super Time scale and posted as MD, M.S.Co-op Marketing Federation, Mumbai -- Vacant Post.\r\n\r\n7) Shri D.N.Khamatkar, MD, MAHANANDA has been Promoted Super Time scale in Same post.\r\n\r\n8) Shri B.S.Munde, Collector, Dhule has been Promoted Super Time scale and posted as Secretary (Labour), Industries, Energy & Labour Department, Mantralaya, Mumbai ---- Vacant post.\r\n\r\n9) Shri S.D.Shinde, Transport Commissioner, M.S., Mumbai has been Promoted Super Time scale in Same post.\r\n\r\n10) Shri S.N.Karle, Deputy Director, Land Records, Pune has been Promoted Super Time scale and posted as CEO, M.S.Khadi & Villege Industries Board, Mumbai in place of Shri S.K.Sawant.\r\n\r\n11) Shri H.R.Pawar, Member Secretary, Mah.Agriculture Education and Research Institute, Pune has been Promoted Super Time scale in Same post.\r\n\r\n12) Shri G.P.Thakur, Jt.Secretary, F,C&CA Department, Mantralaya, Mumbai has been Promoted Super Time scale and posted as MD, Mahatma Phule Backward Class Development Corpn. Mumbai -- Vacant post.","title":"Promotion on Super Time Scale ( Secretary Grade)  (1991 batch) 16.4.2007","publishdatetime":"2007-04-17 10:38:55.0"},{"details":"1) Shri Praveen Pradeshi (85), currently on leave has been transferred as Commissioner, Pune Municipal Corporation, Pune  ------- Vacant Post.\r\n\r\n2) Shri S.K.Sawant (93), CEO, MSKVIB, Mumbai has been posted as OSD, Maharashtra Health Science University's Mumbai Office.---- New Post.","title":"Transferred on 21.4.2007","publishdatetime":"2007-04-25 11:26:17.0"},{"details":"1) Smt.I.A.Kundan (96), Official Secretary, Sikshan Shukla & Control Concil, Mumbai has been Posted as Collector, Mumbai City, Mumbai --- Vacant Post.","title":"Transferred on 24.4.2007","publishdatetime":"2007-04-25 11:27:37.0"},{"details":"\tOne year International MBA Programme with academic affiliation to and in collaboration with the Faculty of Economics, University of Ljubljana, (UOL) \r\n\r\n\r\nAll IAS Officers are requested to visit www.icpe.si. site for detail information of the above mentioned programme and do the needful.\r\n\r\n\t\t\t\t\t\t\t\t\tSd/-\r\n\t\t\t\t\t\t\t\tUnder Secretary\r\n\t\t\t\t\t\t              to Government of Maharashtra.\r\n","title":"One year International MBA Programme with academic affiliation to and in collaboration with the Faculty of Economics, University of Ljubljana, (UOL)  (25.04.2007)","publishdatetime":"2007-04-25 12:29:34.0"},{"details":"1) Shri Johny Joesph (72), Commissioner, BrihanMumbai Municipal Corporation, Mumbai has been Posted as Chief Secretary, Government of Maharashtgra, Mantralaya, Mumbai in place of Dr.D.K.Sankaran.","title":"Transferred on 30.04.2007. (Appointed as CS)","publishdatetime":"2007-04-30 14:49:56.0"},{"details":"1) Dr.J.M.Phatak (78), PS (2), UDD, Mantralaya,  Mumbai has been Posted as Commissioner, Brihanmumbai Municipal Corporation, Mumbai --- Vacant Post.\r\n\r\n2) Shri T.C.Benjamin (79), Settlement Commissioner & Director, Land Records, Pune has been Posted as PS (2), UDD, Mantralaya, Mumbai in place of Dr.Phatak.\r\n\r\n3) Dr.S.K.Sharma(84), Chairman & MD, Mah.State Warehousing Corporation, Pune has been Posted as Settlement Commissioner & Director, Land Records, Pune in place of Shri T.C.Benjamin.\r\n\r\n4) Smt.Meeta Rajiv Lochan (90), Professor, YASHADA, Pune has been posted as Chairman & MD, Mah.State Warehousing Corporation, Pune in place of Dr.S.K.Sharma.\r\n\r\n","title":"Transferred on 4.5.2007","publishdatetime":"2007-05-05 10:34:02.0"},{"details":"1) Shri R.Gopal(72), PS & OSD (Appeals), Revenue & Forests Department, Mantralaya, Mumbai has been Promoted as Additional Chief Secretary & OSD (Appeals), Revenue & Forests Department, Mantralaya, Mumbai.","title":"Promotion of ACS (7.5.2007)","publishdatetime":"2007-05-07 16:24:49.0"},{"details":"1) Shri D.S.Zagade(91)Collector, Raigad has been Posted as Director, Municipal Administration, Mumbai --- Vacant Post.\r\n\r\n2) Shri O.P.Gupta (92), Inspector General of Registration and Controller of Stamp, Pune has been Posted as VS & MD, MSRTC in place of Shri M.N.Kokate.\r\n\r\n3) Smt.Seema Vyas (92), Jt.Secy, GAD, Mantralaya, Mumbai  has been Posted as Collector, Raigad in place of Shri D.S.Zagade.\r\n\r\n4) Smt.Abha Shukla (93), Addl.Div.Commr, Nagpur Division, Nagpur has been Posted as Collector, Yavatmal in place of Shri H.S.Kamble.\r\n\r\n5) Shri Lokesh Chandra(93), Municipal Commissioner, Nagpur Municipal Corpn, Nagpur has been Posted as Addl.Div.Commr., Amaravati Div & Addl.Charge of DG, Vasantrao Naik Self Mishan, in place of Shri S.M.Sarkunde.\r\n\r\n6) Shri Vikas Kharge(94), Collector, Aurangabad  has been Posted as Director, GSDA, Pune -----Vacant Post.\r\n\r\n7) Smt.V.Radha (94), OSD, MSRDC, Mumbai has been Posted as Dy.Commissioner, BMC, Mumbai in place of Shri Satish Bhide.\r\n\r\n8) Shri V.N.More (94), Addl.Commissioner, Sales Tax, MS, Mumbai has been Posted as Jt.Secy., GAD, Mantralaya, Mumbai in place of Smt.Seema Vyas.\r\n\